Title,Content,Link,Category
البنك الأهلي يستحوذ على 24% من أسهم رأسمال شركة أمان,وقع البنك الأهلي المصري عقدي شراء الأسهم واتفاق المساهمين بشأن الاستحواذ على نسبة 24% من أسهم رأسمال شركة أمان لتكنولوجيا الخدمات المالية غير المصرفية والمدفوعات الإلكترونية وذلك بقيمة إجمالية تصل الى 480 مليون جنيه.   وفي تعليق له على تلك الصفقة أكد هشام عكاشة رئيس مجلس إدارة البنك الأهلي المصري أن البنك يستهدف من الاستثمار في الشركة إلى المساهمة في واحدة من أكبر شركات الخدمات المالية غير المصرفية وتعظيم دور البنك في مجال دعم أنشطة الدفع الإلكتروني والخدمات المالية وتمويل مشروعات متناهية الصغر ومن ثم تقديم الخدمات المالية غير المصرفية لأكبر عدد من العملاء وجذب شرائح أكبر من غير المتعاملين مع البنوك، وبما يتسق مع دور البنك في دعم توجهات الدولة والبنك المركزي المصري نحو التحول لمجتمعأقل اعتمادا على النقد ودعم الشمول المالي والذي يعد محوراً هاما من محاور التطور الاقتصادي وتقليص القطاع غير الرسمي ومكافحة غسل الأموال وتمويل الإرهاب، إضافة الى الأثر الإيجابي المتوقع من الاسراع بوتيرة إنجاز الأعمال ودورة التحصيل.مؤكدا على انها تعد احدى الخطوات الهامة التي يتبناها البنك نحو نشر ثقافة السداد الالكتروني وتقليل التعامل النقدي من خلال المساهمة في الشركات الواعدة مثل شركة أمان.ومن جانبه أكد مدحت خليل رئيس مجلس إدارة شركة أمان أن دخول البنك الأهلي المصري مساهما في شركة أمان يعد قيمة مضافة هامة الى أداء الشركة بوصفه أكبر البنوك المصرية، مؤكدا تطلعه الى شراكة ناجحة مع تحقيق معدلات نمو غير مسبوقة تتناسب مع أهمية الكيانين، وهو ما تحرص فرق العمل المعنية بكل من البنك والشركة على تحقيقه من خلال التعاون المثمر والتنسيق الكامل فيما بينهما، خاصة في ضوء امتلاك كلا الطرفان للإمكانات المطلوبة لتحقيق تلك النتائج.  وأضاف يحيى أبو الفتوح نائب رئيس مجلس إدارة البنك الأهلي المصري ان حرص البنك على الاستحواذ على حصة في شركة امان يعد احد الاستثمارات الاستراتيجية للبنك، مؤكدا على ان المفاوضات تمت بنجاح مع ايمان الطرفين بأهمية هذه الشراكة، حيث لا يدخر البنك جهدا في السعي نحو تحقيق الأهداف الاقتصادية للدولة مستفيدا في ذلك بكافة إمكاناته المادية والفنية والبشرية والتكنولوجية التي يمتلكها، مؤكدا على ان سوق الخدمات المالية غير المصرفية يعد سوقا واعدا وما زال حجم الطلب كبير على مثل تلك النوعية من الخدمات، بما يشجع البنك على التوسع في ابرام مزيد من تلك الاتفاقيات سعيا لتشجيع ودعم المدفوعات الالكترونية والتمويل متناهي الصغر وكذا التمويل الاستهلاكي.وأشار أحمد السعيد رئيس مجموعة الاستثمار وأمناء الاستثمار بالبنك الأهلي المصري أن الشراكة مع شركة راية القابضة تأتى في إطار تنفيذ السياسة الاستثمارية للبنك للمشاركة بفاعلية في سوق الخدمات المالية غير المصرفية والمدفوعات الالكترونية بالتعاون مع كبرى الشركات ذات الخبرات الفنية والبشرية المتميزة في هذا المجال، معربا عن شكره وتقديره لفرق العمل من الجانبين الذين تعاملوا بمهارة وحرفية لإتمام الدراسات وكافة الاجراءات التنفيذية لإنجاح هذه الشراكة. جدير بالذكر أن مكتب معتوق وبسيونى للاستشارات القانونية قام بأعمال المستشار القانوني ومكتب جرانت ثورنتون للاستشارات المالية بأعمال التقييم للبنك الأهلي المصري. كما قامت شركة ايليت للاستشارات بأعمال التقييم، وشركة فاروس لترويج وتغطية الاكتتابات بأعمال المستشار المالي للبائع.احصل على تنبيهات لحظية عبر جهازك عند رفع منشورات جديدة بالموقع. اشترك الآن!,https://www.egyentrepreneur.com/%d8%a7%d9%84%d8%a8%d9%86%d9%83-%d8%a7%d9%84%d8%a3%d9%87%d9%84%d9%8a-%d9%8a%d8%b3%d8%aa%d8%ad%d9%88%d8%b0-%d8%b9%d9%84%d9%89-24-%d9%85%d9%86-%d8%a3%d8%b3%d9%87%d9%85-%d8%b1%d8%a3%d8%b3%d9%85%d8%a7/,ريادة أعمال
«كوفيد-19» يكتب تاريخًا جديدًا لقطاع ريادة الأعمال في الإمارات,كتبت جائحة “كوفيد-19” تاريخا جديدا لقطاع ريادة الاعمال في دولة الإمارات العربية المتحدة في مرحلة التحول الاقتصادي بكافة المجالات وقطاعات الأعمال خلال 2020.وفي هذا الشأن، قال عبدالله الحديدي، عضو المبادرة الوطنية للكوتشنج “الارتقاء” -الداعمة لقطاع ريادة الأعمال في الإمارات- إن الجائحة أتاحت فرصا كبيرة أمام قطاع ريادة الأعمال وعززت التوجه نحو الابتكار والتحول الرقمي.وكشف الحديدي أن الابتكار يستهدف التحول بالأفكار إلى واقع ملموس، مؤكدا أن الابتكار بمشروعات ريادة الأعمال ليس رفاهية إنما أصبح حاجة ماسة وسط تزايد المشكلات والتحديات التي تحتاج إلى حلول ريادية وهذا يؤكد وجود الفرص التي أنتجتها الأزمات.وأضاف “الجائحة كما حملت تداعيات سلبية أتاحت فرصا وآفاقا جديدة للعمل”.على سبيل المثال في السابق كان التسوق في المحلات (التقليدي) والإلكتروني متاحان على حدٍ سواء، إلا أنه خلال جائحة “كوفيد-19” زاد الإقبال على التسوق الإلكتروني وعظُمت الحاجة إليه كشرط أساسي للاحتياط ضد مخاطر الإصابة كذلك الحال لكل مزودي الخدمات الذين كانوا يعتبرون أنفسهم و أعمالهم بعيدة عن نطاقات الاعتماد على التكنولوجيا أو تفعيل التحول الرقمي فإن الكثير منهم مثل الصالات الرياضية، الصالونات أو غيرها قاموا بتقديم خدمات ما قبل أو ما بعد البيع من خلال المنصات الرقمية، مما يرسخ لأسلوب حياة جديدة بعد انقضاء الجائحة.وأفاد الحديدي بأن الإمارات قطعت شوطا كبيرا في قطاع ريادة الأعمال، مشيرا إلى أن مساهمة المشاريع الصغيرة والمتوسطة سجلت 53% من الناتج المحلي غير النفطي في الإمارات، بينما تجد أن 98% من المشروعات المسجلة في الدولة صغيرة ومتوسطة مما يعكس أهمية القطاع حاليا ودوره المحوري في المستقبل.وتصنف دولة الإمارات العربية المتحدة بالمركز الثاني عالمياً في نسبة رواد الأعمال، إلى إجمالي عدد السكان في الدولة، وبلغت نسبتهم من البالغين الذين تراوح أعمارهم بين 18 إلى 60 عاماً 8.2% في عام 2019، لتأتي خلف المملكة المتحدة بنسبة 8.4%، وفقاً للتقرير العالمي لريادة الأعمال 2019/2020.ولفت الحديدي إلى أن الإمارات تقدم التسهيلات كافة لنجاح عمل الشركات الناشئة إذ تسمح الأجانب التملك بنسبة 100%، بجانب إتاحة تأشيرات طويلة الأجل للمستثمرين، وتقديم سياسات محفزة وداعمة للشركات الناشئة، وتسهيل الحصول على التمويل لتحتل المركز الأول إقليميا.وأشار إلى أن الاعتماد على التكنولوجيا زاد فرص التوسع أمام العديد من الشركات الناشئة، في المقابل أتاح تقليص عددا من الوظائف في بعض الشركات القائمة ضمن خطط تقليص التكاليف للتكيف مع الأزمة الحالية.وتعاون الحديدي مؤخرا في إلقاء محاضرات في مجال الانطلاق في ريادة الأعمال وتنويع مصادر الدخل وذلك ضمن المبادرة الوطنية للكوتشينج “الارتقاء” والتي تقام تطوعيا بتكاتف مجموعة من المدربين والمختصين في الكوتشينج (التمكين والتحفيز) احتفالا باليوم الوطني الـ 49 للإمارات العربية المتحدة وتستمر من الفترة 6 إلى 31 ديسمبر 2020.وأكد أن هذه الورشة تأتي ضمن سلسلة محاضرات وورش تدريبية مجانية يقدمها أعضاء المبادرة كل يوم سبت واثنين وأربعاء على مدار الشهر، وتستهدف تمكين أفراد المجتمع من اكتشاف ذاتهم، وتطوير قدراتهم، من خلال جلسات تفاعلية عن بعد بالمجان.وأقيمت الورشة التدريبية العامة بحضور جماهيري يفوق 200 مشارك وتفاعلوا في تدريبات عملية لتحقيق الادخار الفعال وبدء تحويل شغفهم ومواهبهم إلى مشاريع عمل مربحة.وذكر أن الورشة التدريبية الأخيرة خلال الأسبوع الماضي كانت من ثلاث محاور: المحور الأول اكتشاف الشغف الذي يحمله كل مشارك في الحياة ويبحث عن تحقيق ذاته قبل التفكير في المردود المادي، عبر استخدم تمارين فعالة في استكشاف رائد الأعمال والمبادر لإمكانياته وبعدها مهاراته ومن ثم ما الذي يحبه؟ ليصل بعدها إلى اكتمال المعادلة بتحديد شغفه وموهبته.وتابع الحديدي: “تضمن المحور الثاني كيفية الانطلاق من العمل في المجال الذي تحبه بناء على نموذج إيكيجاي الياباني إلى الاحترافية وتقديم إمكانياتك كفرص للمساهمة في العالم من حولك”.وكان المحور الثالث تضمن الحديث عن أسرار الادخار كمدخل للاستثمار وكيفية الاستعداد لبدء تقديم رائد الأعمال للخدمات بشكل مستقل أو بدء مشروعه أو الاستثمار في مشاريع مربحة.من جانبه أكد عادل المرزوقي، “كوتش ومدرب الحياة والمشرف العام للمبادرة الوطنية للكوتشينج”: “أن هذه المبادرة تأتي في إطار السعي بث الوعي ورفع مستوى الايجابية في المجتمع الإماراتي شاملا كل أطيافه من المواطنين والمقيمين وهي رسالة من شعب الإمارات لكل من يقيم معنا أننا نسعى إلى استدامة الازدهار والمساهمة في رفع جودة الحياة في الإمارات وأننا جميعا نتحمل هذه المسؤولية”.هي مبادرة وطنية تطوعية أطلقها مجموعة من المواطنين لأفراد المجتمع خلال العيد الوطني الـ49 وتستمر في الفترة من 6 إلى 31 ديسمبر 2020، وتمكن أفراد المجتمع من اكتشاف ذاتهم، وتطوير قدراتهم، من خلال جلسات تفاعلية عن بعد بالمجان.وسجلت المبادرة حتى اليوم 22 كوتشز، يمكنهم تقديم خدماتهم لنحو 250 مستفيد، فيما تم فتح المجال للتطوع من قبل الكوتشز، ممن حصلوا على ما لا يقل عن 60 ساعة تدريبية في مجال الكوتشنج.احصل على تنبيهات لحظية عبر جهازك عند رفع منشورات جديدة بالموقع. اشترك الآن!,https://www.egyentrepreneur.com/%d9%83%d9%88%d9%81%d9%8a%d8%af-19-%d9%8a%d9%83%d8%aa%d8%a8-%d8%aa%d8%a7%d8%b1%d9%8a%d8%ae%d9%8b%d8%a7-%d8%ac%d8%af%d9%8a%d8%af%d9%8b%d8%a7-%d9%84%d9%82%d8%b7%d8%a7%d8%b9-%d8%b1%d9%8a%d8%a7%d8%af/,ريادة أعمال
مهاب مميش يفوز بجائزة الرواد لعام 2020,يسلم اليوم الدكتور خالد عبدالغفار وزير التعليم العالى والبحث العلمى جوائز مسابقة محمد ربيع  ناصر العلمية البحثية السنوية 2020 ، للفائزين من العلماء في مجالاتها الثلاثة الطبية والهندسية والذكاء الاصطناعي كما يسلم جائزة الرواد لهذا العام والتى فاز بها الفريق مهاب مميش رئيس هيئة قناة السويس السابق.تقام أحتفالية توزيع جوائز مسابقة محمد ربيع ناصر العلمية مساء اليوم بحضور عدد من رموز البحث العلمى فى مصر وأعضاء لجان تحكيم الجائزة.وأكد الدكتور أسامه ربيع نائب رئيس جامعة الدلتا أن جائزة محمد ربيع ناصر العلمية البحثية والتى تنظمها جامعة الدلتا للعلوم والتكنولوجيا سنوياً وتحمل أسم رئيس الجامعة تأتى تاكيداً على توجه الجامعة نحو دعم وتحفيز و تشجيع علماء مصر وباحثيها على مداومة العطاء العلمى.وتابع نائب رئيس الجامعة مؤكدا على أن الجائزة تعكس مدى حرص الجامعة على مواكبة التطورات المتسارعة فى البحث العلمى لتطوير المعرفة و الأستكشافات التى تنهض بمشروعات التنمية بالدرجة المأمولة فى النجاح خاصةً فى جانبها الإقتصادى والتنموى وتشجيعًا لشباب الباحثين في مجال العلوم التطبيقية لخدمة أهداف التنمية المستدامة التى تعمل الدولة على تحقيقها.وأكد ربيع على أن لجان التحكيم الجائزة ضمت شخصيات علمية مصرية رفيعة من بينها الدكتور محمد عوض تاج، مستشار رئيس الجمهورية لشئون الصحة والوقاية، والدكتور حسين خالد، وزير الصحة الأسبق، رئيس لجنة القطاع الطبي في المجلس الأعلى للجامعات، والدكتور عبدالوهاب عزت، رئيس جامعة عين شمس السابق.وأشار ربيع الى أن 75 من الباحثين من جميع الجامعات الحكومية والخاصة والمراكز البحثية المتعددة بجمهورية مصر العربية تقدموا في الفروع الثلاثة لجائزة الدكتور محمد ربيع ناصر.احصل على تنبيهات لحظية عبر جهازك عند رفع منشورات جديدة بالموقع. اشترك الآن!,https://www.egyentrepreneur.com/%d9%85%d9%87%d8%a7%d8%a8-%d9%85%d9%85%d9%8a%d8%b4-%d9%8a%d9%81%d9%88%d8%b2-%d8%a8%d8%ac%d8%a7%d8%a6%d8%b2%d8%a9-%d8%a7%d9%84%d8%b1%d9%88%d8%a7%d8%af-%d9%84%d8%b9%d8%a7%d9%85-2020/,ريادة أعمال
«رواد النيل» ترعى مشروع طلابي لتصميم وتصنيع سيارة تعمل بالكهرباء,أعلنت مبادرة رواد النيل الممولة من البنك المركزي المصري وتنفذها جامعة النيل الأهلية عن مساهمتها في رعاية مشروع طلابي لتصميم وتصنيع سيارة تعمل بالكهرباء، ضمن مسابقة مهرجان رالي السيارات الكهربائية EVEREGYPT، التي تقام يوم السبت المقبل.وقالت الدكتورة هبة لبيب المدير التنفيذي لمبادرة رواد النيل إن هذه المسابقة تعد الأولى من نوعها في الشرق الأوسط ويشارك فيها نحو 20 فريقا من 20 جامعة من مختلف أنحاء مصر.وأشار إلى أن رعاية هذا المشروع تعكس إهتمام جامعة النيل الأهلية بدعم المشاريع المبدعة، ما دفع مبادرة رواد النيل للمساهمة في تقديم الدعم لفريق ( RPMUS Team) لتصميم و تصنيع سيارة كهربائية ( Electric vehicle  ) والمشاركة في  المسابقة، التي تهدف إلى تشجيع البحث العلمي و الأبداع في مجال السيارات الكهربائية في مصر.وأضافت أن رعاية مبادرة رواد النيل للمشروع يأتي في ضوء التوجه العام الحالي للدولة المصرية في مجال تصميم وتصنيع السيارات الكهربائية لما لها من فوائد وعوائد متنوعة على الطاقة و البيئة في مصر.ولفت إلى  إلى أن المبادرة تقوم بتقديم الدعم الفني والمالي والمراجعة الفنية للمشروع قبل الحصول على الدعم المالي.وأوضحت أن المسابقة تعد أول مسابقة تكنولوجية في صناعة السيارات الكهربائية يشترك فيها طلبة جامعيين مبتكرين، وتتيح لهم بيئة عمل حقيقية كما تشكل تحديا للفرق المشاركة لتصميم، تصنيع واختبار “سيارة” تعمل بالكهرباء وتلبي المتطلبات اليومية للمستخدم على النحو الأمثل.يشار إلى ان مهرجان رالي السيارات الكهربائية يعقد هذا العام للسنة الثالثة على التوالي وترعاه أكاديمية البحث العلمي، وجامعة عين شمس ومركز الإبتكار والتطوير iHub وتعقد المسابقة في منطقة الأهرامات.وقال  الدكتور محمد عباس  مدير برنامج حاضنات الأعمال بمبادرة رواد النيل إن فريق RPMUS يمثل كلية الهندسة جامعة النيل الأهلية، وتعد تلك المشاركة الثانية على التوالي للفريق والذي حصل في مسابقة العام الماضي على المركز الأول كأفضل Business Model .ولفت إلى أن الفريق قام هذا العام بتطوير العمل من حيث التصميم وتصنيع هيكل السيارة وتجمعيها فى ورش كلية الهندسة جامعة النيل الأهلية تحت إشراف مباشر من الجامعة ، فيما قام فريق عمل مبادرة رواد النيل بتقديم المراجعة الفنية والدعم الفني للمشروعاحصل على تنبيهات لحظية عبر جهازك عند رفع منشورات جديدة بالموقع. اشترك الآن!,https://www.egyentrepreneur.com/%d8%b1%d9%88%d8%a7%d8%af-%d8%a7%d9%84%d9%86%d9%8a%d9%84-%d8%aa%d8%b1%d8%b9%d9%89-%d9%85%d8%b4%d8%b1%d9%88%d8%b9-%d8%b7%d9%84%d8%a7%d8%a8%d9%8a-%d9%84%d8%aa%d8%b5%d9%85%d9%8a%d9%85-%d9%88/,ريادة أعمال
الشركات الناشئة المصرية تجذب 3 مليارات جنيه خلال 10 سنوات,قالت الدكتورة غادة خليل مدير مشروع رواد 2030، إن الشركات الناشئة، ومشروعات ريادة الأعمال، على المعرفة والابتكار، هي الداعم الرئيسي للنمو الاقتصادي الشامل والمستدام، وهي أيضا المحرك الرئيسي لزيادة القدرة التنافسية للاقتصاد.وأضافت خلال إلقاء كلمة وزارة التخطيط، خلال فعاليات الدورة الثالثة للمؤتمر والمعرض الدولي للاستثمار والتوكيلات التجارية بمصر والشرق الأوسط «بيزنكس 2020»، أن إجمالي عدد المنشآت للمشروعات المتوسطة والصغيرة والمتناهية الصغر 3.653 مليون منشأة.وأضافت أنها  تتضمن 9.7 مليون فرصة عمل، بإجمالي أجور وصلت إلى 119.2 مليار جنيه، وإنتاج قيمته 1.237 تريليون جنيه، وقيمة مضافة إجمالية بلغت 804 مليار جنيه.وفقا لبيانات التعداد الاقتصادي الأخير الصادر عن الجهاز المركزي للتعبئة والإحصاء.وأكدت على أن ذلك الأهمية البالغة التي تستحوذ عليها المشروعات الصغيرة والمتوسطة والمتناهية الصغر داخل الاقتصاد المصري.وأوضحت «خليل» أنه وفقا لأخر مؤشرات أصدرها رواد ميتر، فإن الشركات الناشئة التي جذبت استثمارات خارجية بلغ عددها 402 شركة في أخر 10 سنوات، بإجمالي استثمارات وصل إلى 3 مليارات جنيه.ويعتبر رواد ميتر هو احد مشروعات رواد ٢٠٣٠ تحت رعاية وزارة التخطيط والتنمية الاقتصادية. تم إنشاء رواد ٢٠٣٠ عام ٢٠١٧ بهدف تمكين الشباب من تأسيس المشروعات الخاصة والعمل على تكريس ودعم دور ريادة الأعمال في تنمية الاقتصاد الوطني من خلال وضع منظومة متكاملة للابتكار تتماشى مع رؤية مصر ٢٠٣٠.ووفقا لمؤشرات العام الماضي، فإن مصر استحوذت على مايقدر بـ25 % من إجمالي الاستثمارات التي تم ضخها في الشركات الناشئة بمنطقة الشرق الأوسط وشمال أفريقيا.وأشارت إلى أن موضوع «بيزنكس 2020» يأتي ضمن توجه الدولة المصرية في الآونة الأخيرة بإتاحة وتمكين فرص الاستثمار وتنمية المشروعات الصغيرة والمتوسطة ومتناهية الصغر ودعم ريادة الأعمال، وعملت الحكومة على دعم وتعزيز دور هذا القطاع من خلال تذليل كافة العقبات والتحديات التي تواجهه وعلى رأسها إتاحة التمويل. احصل على تنبيهات لحظية عبر جهازك عند رفع منشورات جديدة بالموقع. اشترك الآن!,https://www.egyentrepreneur.com/%d8%a7%d9%84%d8%b4%d8%b1%d9%83%d8%a7%d8%aa-%d8%a7%d9%84%d9%86%d8%a7%d8%b4%d8%a6%d8%a9-%d8%a7%d9%84%d9%85%d8%b5%d8%b1%d9%8a%d8%a9-%d8%aa%d8%ac%d8%b0%d8%a8-3-%d9%85%d9%84%d9%8a%d8%a7%d8%b1%d8%a7%d8%aa/,ريادة أعمال
