Title,Content,Link,Category
Paymob تحصد ٣.٥ ملايين دولار للتوسع في شبكة التجار وتسريع التوسع الإقليمي,"أعلنت شركة خدمات الدفع الرقمية المصرية Paymob، والتي أسسها إسلام شوقي، وآلان الحاج، ومصطفى المنيسي، عن حصولها على استثمارات بقيمة ٣,٥ ملايين دولار بفضل مكانتها السوقية وأدائها الممتاز. تأتي حزمة الاستثمارات الجديدة بقيادة شركة Global Ventures وبنك تنمية ريادة الأعمال الهولندي “FMO”، واستثمار إضافي من شركة A15.وتوظف Paymob هذه الاستثمارات لتتوسع في شبكة التجار والاستجابة للإقبال المتزايد على خدماتها، إلى جانب تطوير منتجاتها والتواجد بشكل أكبر على الصعيد الإقليمي.  تقوم البنية التحتية للمحافظ الإلكترونية للهواتف المحمولة من Paymob بإتمام أكثر من ٨٥٪ من الحصة السوقية للمعاملات التي تتم في السوق المصري. كما تخدم التجار في خمسة أسواق مختلفة بما فيها كينيا، وباكستان، وفلسطين إلى جانب السوق الرئيسي في مصر، مما يجعلها أول شركة تكنولوجيا مالية مصرية تتوسع خارج نطاق السوق المحلي.وتواصل Paymob الاستثمار في بنيتها التحتية لتعزز من التحول الرقمي في مجال المدفوعات عبر دعمها لآلاف التجار المحليين والعالميين مثل سويڤل، والجونة، وتريد لاين، وBeFit، جورميه، ومترو ماركت، مما يخدم ملايين العملاء شهرياً عبر أفضل منتجات الدفع سواء عبر الإنترنت أو داخل المتاجر.  وصرح إسلام شوقي، الشريك المؤسس ورئيس مجلس إدارة التنفيذي Paymob: “في عالم يستخدم فيه المستهلكون المنتجات الرقمية في جميع مناحي الحياة، فإن الوقت قد حان للاستثمار في منتجات Paymob لتقدم المزيد من الدعم للاقتصاد الرقمي.وتابع أن الظروف الاستثنائية التي مر بها العالم خلال العام الحالى أثبتت مدى الحاجة لبنية تحتية قوية لحلول المدفوعات الرقمية، فهناك ضرورة لتلبية احتياجات الأعمال المتنوعة والشركات بأحجامها خلال جائحة فيروس كورونا، والتي نتج عنها زيادة مهولة تقدر بـ٤٥٠٪ في معدل انضمام التجار لخدماتنا الرقمية منذ بداية الجائحة“. وقال آلان الحاج، الشريك المؤسس ورئيس قطاع العمليات في Paymob: ” يستفيد تجار وشركاء Paymob مباشرةً من هذه الجولة التمويلية حيث سنقوم بتوظيف هذه الاستثمارات لتحسين خدماتنا في مجال المدفوعات لنتمكن من خدمة القاعدة الحالية من المستخدمين بشكل أفضل إلى جانب الاستجابة للإقبال المتزايد على منتجاتنا. دعم شبكة التجار والشركاء في مصر وأفريقيا كان وسيظل أساس كل ما نقوم به في Paymob”. وتقوم Paymob بتوظيف هذا التمويل لدعم قطاع الشركات الصغيرة والمتوسطة الذي يعاني من نقص كبير في هذا النوع من الخدمات، وذلك عبر توفير حلول الدفع الرقمي المحسنة وإتاحتها بشكل أكبر. يأتي ذلك في إطار جهود ومبادرات البنك المركزي المصري نحو تحقيق الشمول المالي والرقمي على مستوى الجمهورية. أما على الصعيد الخارجي، ستقوم Paymob بدفع توسعاتها الإقليمية وإتاحة منتجاتها في مزيد من الأسواق الأفريقية والخليجية، لتعزز الشركة بذلك من مكانتها كأحد رواد تقديم خدمات المدفوعات في المنطقة.وقال باسل مفتاح، الشريك العام في Global Ventures: “نحن في غاية الحماس لعقد هذه الشراكة مع فريق Paymob، حيث أن الحاجة إلى الشمول المالي أصبحت ضرورة لا غنى عنها في ظل الجائحة العالمية الحالية.وتتمتع Paymob بفريق نشيط وديناميكي، ولديها مكانة سوقية مميزة تمكنها من تقديم حلول متكاملة للبنية التحتية وخدمات المدفوعات المتنوعة سواء من حيث وسائل أو قنوات الدفع. وتتشابه Paymob مع Global Ventures في عدة نقاط، مثل القدرة على رؤية المشكلات من زاوية مختلفة، والإبداع في إعادة هيكلة سبل التنفيذ، والشجاعة لإتمام المهام ومواجهة التحديات“. Global Ventures هي شركة استثمار مغامر دولية تتواجد في أبوظبي، والقاهرة، ودبي، وجدة، وفيلادلفيا، وسان فرانسيسكو.  كما صرح ياب رينكينج، رئيس قطاع الاستثمارات الخاصة في   FMO Paymob:  ” FMO Paymob  هي المرشح المثالي لبرنامج  FMO للاستثمار في الشركات FMO Ventures Program وذلك بفضل فريقها الاستثنائي، و حلول الدفع المبتكرة التي تقدمها، منصتها التكنولوجية المالية القابلة للتوسع. في مصر، تساهم Paymob في واحدة من أهم عمليات التحول الرقمي التي تشهدها القارة الأفريقية، ويأتي دعم وخدمة المستهلكين والشركات الصغيرة التي تعد في أمس الحاجة لهذه الخدمات في صميم رؤية كل من Paymob وFMO.” برنامج FMO Ventures Program هو برنامج استثمار بقيمة ٢٠٠ مليون يورو تم تأسيسه بدعم من FMO، ووزارة الخارجية الهولندية، والمفوضية الأوروبية. ويستهدف نماذج الأعمال المبتكرة المدعومة بالتكنولوجيا خلال مراحلها الأولية والتي تعمل في الأسواق الناشئة.وصرح كريم بشارة رئيس مجلس إدارة A15: “منذ استثمارنا الأول في Paymob، حقق الفريق قفزات ملحوظة في معالجته لمسألة بالغة الأهمية في منطقتنا وهي الشمول المالي. نحن سعداء للمساهمة في شركة تقوم بتمهيد الطريق لإتمام المعاملات المالية اليومية وتعظيم إنتاجية ملايين البشر، ونفخر بدعم فريق من الشباب الشغوف في مسعاهم لإحداث ثورة حقيقية في النظم المالية في مصر والمنطقة، وما هو أبعد من ذلك أيضاً“.Paymob تمكن البنية التحتية التكنولوجية بتقديم حلول الدفع لمقدمي الخدمات المالية الرقمية عبر أفريقيا والشرق الأوسط من خلال تكنولوجيا المحافظ الإلكترونية Mobile Wallets المبتكرة التي تتيح المدفوعات المالية والرقمية لعملاء المؤسسات والشركات. تهدف Paymob إلى المساهمة في حركة الشمول المالي والمساهمة في النمو الاقتصادي عبر تطبيق حلول المدفوعات اللا نقدية داخل المجتمع.  هي شركة رأس مال مغامر دولية تتواجد في أبوظبي، والقاهرة، ودبي، وجدة، وفيلاديلفيا، وسان فرانسيسكو. تعمل Global Ventures مع شركات ذات توجه عالمي في مرحلة النمو، مع التركيز على تكنولوجيا الشركات. وصلت Global Ventures إلى ١٦ سوقاً مختلفاً، وقامت باستعراض أكثر من ٥٠٠ صفقة في ١٠ مجالات ولديها أكثر من ١٥ وعاء استثماري.  الـFMO هو بنك تنمية ريادة الأعمال الهولندي، ويعد من رواد الاستثمار عالي التأثير، ويدعم البنك النمو المستدام في القطاع الخاص في الدول النامية والأسواق الناشئة عبر الاستثمار في المشاريع الطموحة ورواد الأعمال ذوي الرؤية.ويؤمن بنك FMO أن القطاع الخاص القوي يؤدي إلى تنمية اقتصادية ومجتمعية، ولديه سجل أعمال مثبت على مدار ٥٠ عاماً من دعم الأفراد في توظيف مهاراتهم وتحسين مستوى معيشتهم. ويركز بنك FMO على ٣ قطاعات ذات تأثير تنموي مرتفع: المؤسسات المالية، والطاقة، والأعمال الزراعية من ماء وغذاء. مع محفظة بقيمة ١٠.٤ مليار يورو في أكثر من ٨٠ دولة، يعد بنك FMO واحد من أكبر بنوك التنمية المزدوجة للقطاع الخاص على الصعيد العالمي. احصل على تنبيهات لحظية عبر جهازك عند رفع منشورات جديدة بالموقع. اشترك الآن!",https://www.egyentrepreneur.com/paymob-%d8%aa%d8%ad%d8%b5%d8%af-%d9%a3-%d9%a5-%d9%85%d9%84%d8%a7%d9%8a%d9%8a%d9%86-%d8%af%d9%88%d9%84%d8%a7%d8%b1-%d9%84%d9%84%d8%aa%d9%88%d8%b3%d8%b9-%d9%81%d9%8a-%d8%b4%d8%a8%d9%83%d8%a9-%d8%a7/,ريادة أعمال
كل ما تريد معرفته عن منحة جامعة سوهاج لريادة الأعمال,"أعلنت جامعة سوهاج عن بدء التسجيل في منحة برنامج InnovEgypt لبناء قدرات طلاب الجامعات في مجال الإبداع وريادة الأعمال، والذى ينظم بالتعاون بين مركز الخدمات الالكترونية والمعرفية بالجامعة ومركز الإبداع التكنولوجي وريادة الأعمال بوزارة الإتصالات وتكنولوجيا المعلومات،ويتم التدريب الطلاب بمنحة برنامج  InnovEgypt عن طريق “الاون لاين”وقال الدكتور أحمد عزيز عبد المنعم رئيس الجامعة، وقال أن البرنامج متخصص في مجال الابتكار و ريادة الأعمال وهو موجه لطلاب الجامعات المصرية في تخصصات تكنولوجيا المعلومات والاتصالات ليصبحوا مبدعين ورواد أعمال في المستقبل.وأوضح رئيس الجامعة أن البرنامج يهدف إلى تدريب الطلاب وبناء قدراتهم وإمدادهم بالمفاهيم الأساسية في مجال الإبداع التكنولوجي وريادة الأعمال، وكذلك استخدام الأساليب الممنهجة والأدوات المساعدة على توليد أفكار مبتكرة لمواجهة التحديات والمشكلات، إلى جانب التدريب على كيفية تطبيق هذه الأفكار وتحويلها لشركات ناشئة ناجحة.وقال الدكتور محمود أبو العز مدير مركز الخدمات الالكترونية والمعرفية بالجامعة، أن البرنامج يستهدف طلاب كليات العلوم، الهندسة، التجارة، الحاسبات والمعلومات والذكاء الاصطناعي، التكنولوجيا والتعليم.وأشار  إلى البرنامج سينفذ من خلال التدريب بطريقة “الاون لاين” علي مدار ٤ أسابيع بواقع دورة كل أسبوع، تبدأ من 8 أغسطس حتي 3 سبتمبر القادم، مما يتيح للمتقدم اختيار الأسبوع المناسب له.وأضافت شيماء الشيخ سفيرة مركز الإبداع وريادة الأعمال بالجامعة، أن البرنامج منحة مجانية بالكامل ويستغرق 30 ساعة بواقع 4 ساعات يومياً علي مدار 4 أيام منها 16 ساعة تفاعلية داخل ورش عمل تدريبية،وأوضحت  أن البرنامج يتيح للمتدربين فرصة للاشتراك في مسابقة Ideathon والحصول على جوائز مجموعها 360,000 جنيه،يحصل الطالب بعد إنتهاء التدريب على شهادة معتمده من مركز الإبداع التكنولوجي وريادة الأعمال بوزارة الإتصالات.يمكن لطلاب الجامعة التقديم من استمارة التقديم متوفرة خلال رابط«منحة InnovEgypt»احصل على تنبيهات لحظية عبر جهازك عند رفع منشورات جديدة بالموقع. اشترك الآن!",https://www.egyentrepreneur.com/%d9%83%d9%84-%d9%85%d8%a7-%d8%aa%d8%b1%d9%8a%d8%af-%d9%85%d8%b9%d8%b1%d9%81%d8%aa%d9%87-%d8%b9%d9%86-%d9%85%d9%86%d8%ad%d8%a9-%d8%ac%d8%a7%d9%85%d8%b9%d8%a9-%d8%b3%d9%88%d9%87%d8%a7%d8%ac-%d9%84%d8%b1/,ريادة أعمال
انطلاق أسبوع ريادة الأعمال بكليات جامعة الأزهر,أعلن نادي ريادة الأعمال بجامعة الأزهر، انطلاق أسبوع ريادة الأعمال بكليات الجامعة ومعاهدها في الفترة من 7 أغسطس إلى 14 أغسطس 2020.وناشدت جامعة الأزهر الكليات ترشيح 50 طالبا من كل كلية للمشاركة في الأسبوع التدريبي في مجال ريادة الأعمال علما بأن التدريب سيجرى إلكترونيا عن بعد وسيتم إعلام الطلاب بذلك في موعده.يأتي لك نظرا إلى الأهمية البالغة لريادة الأعمال والتأهيل لوظائف المستقبل والإسهام في الحد من البطالة فقد أنشأت الجامعة نادي ريادة الأعمال.وتتمثل رؤية النادي، في بناء جيل من رواد الأعمال قادر على المنافسة محليا وإقليميا ودوليا بمشروعات مميزة تسهم في تنمية المجتمع وتحقيق التنمية المستدامة ورغبة من النادي في تحقيق رسالته وأهدافه للوصول إلى ما يسمى بالجامعة الريادية.احصل على تنبيهات لحظية عبر جهازك عند رفع منشورات جديدة بالموقع. اشترك الآن!,https://www.egyentrepreneur.com/%d8%a7%d9%86%d8%b7%d9%84%d8%a7%d9%82-%d8%a3%d8%b3%d8%a8%d9%88%d8%b9-%d8%b1%d9%8a%d8%a7%d8%af%d8%a9-%d8%a7%d9%84%d8%a3%d8%b9%d9%85%d8%a7%d9%84-%d8%a8%d9%83%d9%84%d9%8a%d8%a7%d8%aa-%d8%ac%d8%a7%d9%85/,ريادة أعمال
شركة «fetchr» تجمع 15 مليون دولار,حصلتfetchr الشركة الناشئة لخدمات التوصيل التي تتخذ من دبي مقرا لها، على تمويل بقيمة ١٥ مليون دولار للتوسع في السعودية.فإن أحدث جولة تمويل والتي لا تزال بحاجة إلى موافقة المساهمين، قد تشهد زيادة في التعهدات المالية لتصل إلى ٢٥ مليون دولار، بحسب موقع «بلومبيرج».وتوضح الوثائق أن الشركة حصلت على تعهدات من شركة بيكو كابيتال، ومجموعة تامر السعودية، وشركة الشحن الفرنسية سي إم إيه سي جي إم إس.كانت فتشر قد اقتربت من الإفلاس العام الماضي لكنها حصلت على تمويل طارئ بقيمة ١٠ ملايين دولار في محاولة لإنعاشها، والآن تحاول الشركة استكمال محاولة الإنقاذ مع جولة استثمارية جديد بقيمة ١٥ مليون دولار.يشار أن تراجع فتشر تسبب في إغلاق المنصة لعملياتها في الأردن، والبحرين، وعمان. كما ساهم بخسارة ١٢٠٠ وظيفة وقتها، لكنها تطمح الآن للعودة مجددا لمكانها الطبيعي بالتوسع في السوق السعودي بمساهمة من التمويل الجديد.احصل على تنبيهات لحظية عبر جهازك عند رفع منشورات جديدة بالموقع. اشترك الآن!,https://www.egyentrepreneur.com/%d8%b4%d8%b1%d9%83%d8%a9-fetchr-%d8%aa%d8%ac%d9%85%d8%b9-15-%d9%85%d9%84%d9%8a%d9%88%d9%86-%d8%af%d9%88%d9%84%d8%a7%d8%b1/,ريادة أعمال
«جامعة القناة» تفوز بمشروع من الاتحاد الأوروبي في تكنولوجيا ريادة الأعمال,اختيرت جامعة قناة السويس كمنسق رئيسي بمشروع ممول من الاتحاد الأوروبي، تحت عنوان “تكنولوجيا ريادة الأعمال لتعزيز الاستدامة في منطقة الشرق الأوسط وشمال أفريقيا” يأتي المشروع بالتعاون بين كليتي الطب و التربية بجامعة القناة.وأشارت إلى أن المراكز ستعمل على تطوير البنية التحتية والموارد البشرية في المنطقة وذلك بإنشاء درجة دبلومة مشتركة مع شركاء أوروبيين في مجال تكنولوجيا ريادة الأعمال.واضافت ستقوم تلك المراكز بعمل تدريبات وأنشطة مختلفة في مجال تكنولوجيا ريادة الأعمال بالاعتماد على نظام التعلم المختلط باستخدام التعلم عن بعد وأيضا التطبيق العملي بمشاريع ومهام.وتابعت سيتم عمل اتفاقيات ومذكرات تفاهم مع الجانب الأوروبي في هذا المجال لنقل خبرتهم في مجال تكنولوجيا ريادة الأعمال إلى منطقة الشرق الأوسط وشمال أفريقيا.ومن جانبها أشارت الدكتورة نهال لطفي منسق مشاريع الإيراسموس بجامعة قناة السويس أن المشروع يشارك به 10 جامعات من أوروبا ومنطقة الشرق الأوسط وشمال أفريقيا من 7 بلدان.وأوضحت أن الجامعات المشاركة هي جامعة قناة السويس وجامعة حلوان من مصر، جامعة سوسة وجامعة صفاقس من تونس، جامعة الروح القدس والجامعة اللبنانية الأمريكية من لبنان. كما تشارك جامعات أجنبية من ألمانيا وإيطاليا وإسبانيا وأيرلندا.وأوضحت فريق العمل من جامعة قناة السويس يضم كلا من هم الدكتورة هدي يسري عبد الله مدرس بكلية الطب والمنسق الرئيسي للمشروع والدكتورة زينب عوف مدرس بكلية الطب والدكتورة هادية عبد الرحيم مدرس بكلية التربية والدكتورة فاطمة أمين مدرس بكلية العلوم والدكتور حسين عبد الفتاح مدرس بكلية التربية والدكتورة نهال لطفي مدرس بكلية التربية منسق مشاريع الإيراسموس بجامعة قناة السويس.واتمت ان جامعة قناة السويس فازت ايضا بعضوية مشروع بناء الكفاءة في التعليم العالي والممول من الاتحاد الاوروبي بعنوان تعزيز الطاقة الحرارية الجوفية في مصر ويمثل الجامعة بالمشروع الدكتور محمد عبد الفتاح قسم الجيولوجيا كلية العلوم. احصل على تنبيهات لحظية عبر جهازك عند رفع منشورات جديدة بالموقع. اشترك الآن!,https://www.egyentrepreneur.com/%d8%ac%d8%a7%d9%85%d8%b9%d8%a9-%d8%a7%d9%84%d9%82%d9%86%d8%a7%d8%a9-%d8%aa%d9%81%d9%88%d8%b2-%d8%a8%d9%85%d8%b4%d8%b1%d9%88%d8%b9-%d9%85%d9%86-%d8%a7%d9%84%d8%a7%d8%aa%d8%ad%d8%a7%d8%af/,ريادة أعمال
ما هو دور ريادة الأعمال في دعم الاقتصاد المصري,تلعب ريادة الأعمال في الوقت الراهن في دور كبير دعم المشاريع الكبيرة ودعمها بالكثير من الخدمات والسلع المهمة، وتننشط مختلف القطاعات الاقتصادية الزراعية منها والصناعية والتجارية والخدمية، وتساعد على الارتقاء بمستويات الادخار والاستثمار.يعتبر الابتكار والإبداع أعمدة رئيسية لبقاء منظمات الأعمال ، فالروح الإبداعية تجعل الشركات الناشئة تستغل الفرص المتاحة مما يدعم المنافسة في الأسواق.تمثل ريادة الأعمال أحدى العناصر الرئيسية التى تدفع عجلة الاقتصاد المصرى، وتعمل على زيادة الترابط بين الاقتصاد وتحسين البيئة، ولذلك كان للدولة المصرية.ويوضح مشروع رواد 2030 التابع لوزارة التخطيط والتنمية الاقتصادية أهمية ريادة الأعمال ودورها في الاقتصاد والبيئة في النقاط التالية:وقالت غادة خليل، مدير مشروع رواد 2030 بوزارة التخطيط والتنمية الاقتصادية،إن الهدف الرئيس من المشروع هو نشر فكر ريادة الأعمال، والعمل الحر بين الشباب.وأشارت إلى أن تحقيق هذا الهدف يتم من خلال محاور تعليمية وعملية وتوعوية، من أجل تقديم المساعدة للشباب لإنشاء أعمالهم الخاصة، وتحقيق مشروعاتهم على أرض الواقع.وأوضحت خليل أن المشروع عقد اتفاقيات مع أعرق الجامعات المحلية والدولية لإتاحة فرص تدريبية وبرامج ماجيستر فى مجال ريادة الأعمال.وأشارت إلى التعاون مع جامعة كامبريدج البريطانية والجامعة الأمريكية بالقاهرة لتنظيم برامج ماجيستر لعدد من الشباب فى مجال ريادة الأعمال، فضلًا عن توقيع بروتوكول تعاون مع وزارتي التربية والتعليم، والتجارة والصناعة وجهاز المشروعات الصغيرة والمتوسطة قبل عامين لتدشين حملة “ابدأ مستقبلك” لتوعية طلاب المدارس بفكر ريادة الأعمال بكل الإدارات التعليمية بمحافظات الجمهور.وأكدت خليل أن الاهتمام بالجانب التعليمى لدعم ونشر ثقافة ريادة الأعمال ساهم في تدشين عدد من المشروعات المبتكرة، أدى إلى ظهور عدد من الابتكارات مثل تطبيق موبايل يمكَن من الكشف عن إصابات فيروس كورونا بشكل مطور، بالإضافة إلى مشروعات أخرى تخدم توجهات الدولة لتحقيق التنمية الاقتصادية ومحاور الأجندة الوطنية للتنمية المستدامة؛ رؤية مصر 2030احصل على تنبيهات لحظية عبر جهازك عند رفع منشورات جديدة بالموقع. اشترك الآن!,https://www.egyentrepreneur.com/%d9%85%d8%a7-%d9%87%d9%88-%d8%af%d9%88%d8%b1-%d8%b1%d9%8a%d8%a7%d8%af%d8%a9-%d8%a7%d9%84%d8%a3%d8%b9%d9%85%d8%a7%d9%84-%d9%81%d9%8a-%d8%af%d8%b9%d9%85-%d8%a7%d9%84%d8%a7%d9%82%d8%aa%d8%b5%d8%a7%d8%af/,ريادة أعمال
