Title,Content,Link,Category
ارتفاع  عدد الشركات الناشئة التي حصلت على استثمارات في مصر إلى 142,ارتفع عدد الشركات الناشئة التي حصلت على استثمارات في مصر العام الماضي 142 شركة بزيادة 26% عن عام 2018.بلغت قيمة تمويل الشركات الناشئة في مصر 95 مليون دولار العام الماضي بزيادة 13%، بحسب تقرير صادر اليوم من موقع ماجنييت المهتم بالشركات الناشئة.جذبت الشركات الناشئة في مصر العام الماضي 52 مستثمر نحو ثلثيهم من خارج البلاد وهو العدد الأكبر من المستثمرين على الإطلاق.التخارج هو بيع الملاك الأصليين للشركة الناشئة لها لصالح شركات أو مستثمرين آخرين ومن أمثلة التخارج  الشهيرة في الشرق الأوسط شراء شركة أوبر لمنافستها في الشرق الأوسط كريم.شركة أبحاث متخصصة بمتابعة المشاريع والشركات الناشئة ورواد الأعمال في منطقة الشرق الأوسط وشمال إفريقيا ومقرها دبي، بحسب موقع الشركة الإلكتروني.وتطرق التقرير إلى أن 2020 سيشهد افتتاح عدد كبير من الشركات الأجنبية لفروع إقليمية بمنطقة الشرق الأوسط، مدعومًا ببدء نشاط شركة WeWork الخاصة بمساحات العمل المشتركة والتي ستتيح دخول شركات جديدة دون الحاجة لاستثمارات هائلة لبدء نشاطها بالأسواق المحلية.وتوقعت “ماجنت” أن عام 2020 سيكون الأعلى في حجم التخارج من الشركات الناشئة، خاصة بعد إتمام صفقات الاستحواذ السابقة، وتوجه عدد من صناديق الاستثمار والشركات الكبرى لدمج علامات تجارية للشركات الناشئة ضمن الشركات الأم مثل نقل تبعية “سوق دوت كوم” لتصبح “أمازون الإمارات”، ودخول شركة “هارمونيكا” التي استحوذت عليها “ماتش جروب” ضمن المنصة الخاصة بالأخيرة.وانتهت منذ أيام صفقة استحواذ شركة أوبر تكنولوجيز الأميركية على شركة كريم الإماراتية ومقرها دبي، بصفقة تقدر قيمتها بنحو3.1 مليار دولار، جزء منها نقدي، والجزء الآخر عبر منح سندات قرض قابلة للتحويل.احصل على تنبيهات لحظية عبر جهازك عند رفع منشورات جديدة بالموقع. اشترك الآن!,https://www.egyentrepreneur.com/%d8%a7%d8%b1%d8%aa%d9%81%d8%a7%d8%b9-%d8%b9%d8%af%d8%af-%d8%a7%d9%84%d8%b4%d8%b1%d9%83%d8%a7%d8%aa-%d8%a7%d9%84%d9%86%d8%a7%d8%b4%d8%a6%d8%a9-%d8%a7%d9%84%d8%aa%d9%8a-%d8%ad%d8%b5%d9%84%d8%aa/,ريادة أعمال
للبقاء في خضم المنافسة الشرسة.. كيف تتمكن الشركات الناشئة من الاستمرار؟,يخلو عمل تجاري من المنافسة، حيث أنها أساس العمل في الشركات التجارية، لما تقوم به من المنافسة من دفع للشركات الناشئة والكبيرة أيضًا للابتكار والمثابرة والصمود في ظل عالم يتسم بالتغير والابتكار يوماً بعد يوم.وفي إطار التزامها بتقديم النصائح اللازمة لرواد الأعمال وأصحاب الشركات الناشئة ، ترصد « شبكة EP » بعض العوامل التي تساعد الشركات الناشئة على البقاء في حيز المنافسة مع نظيراتها الصغيرة وأيضًا الكبيرة.لا يستطيع أحد أن ينكر أن التفكير في المنافسة وضمان الاستمرارية أمر صعب للغاية خاصة على الشركات الناشئة التي تفتقد في الكثير من الأحيان إلى الخبرات والتمويلات اللازمة التي تمكنها من الاستمرار في المنافسة، لذا يجب على أصحاب الشركات الناشئة نقل الخبرات والتجارب السابقة من الشركات الكبرى التي تعمل في نفس المجال لجذب أكبر شريحة ممكنة العملاء وبالتالي زيادة المبيعات والأرباح على المزيد من المبيعات.ويساعد وجود منافس لك في نفس المجال على تحفيزك للتطور والابتكار واختراع كل ما هو جديد للحفاظ على عملائك، حيث أوضحت “جلوبال ريسورسيز” في مقال لها بعنوان “التغلب على المنافسة”، أن وجود منافس في نفس مجال عملك يدفعك إلى الجري بسرعة أكبر والعمل بجدية وتفكير أعمق، حيث أنه يقود للابتكار ويلهم المثابرة ويبني روح الفريق، فضلاً عن أن المنافسة تجعل اللعبة أكثر إثارة للاهتمام وأكثر متعة.يقول أوليغ شيشيجول، المؤسس المشارك والرئيس التنفيذي شركة SEMrush، “توقف عن مراقبة المنافسة وفكر بنفسك”، وعلى جميع الشركات أن تتمتع بنقاط قوة خاصة بها، وهي الميزة التي تتمتع بها عن منافسيك، فإذا لم يكن لديك أي ميزة في المنتج الذي تقدمه شركتك مقارنة بالماركات الأخرى، فعليك العودة إلى التخطيط لمشروعك من جديد، حيث أن الميزة التي يتسم بها منتجك أو خدمتك هي التي تكون قادرة على تحديد نسبة مبيعاتك أو احتمالية إفلاسك، إذا لم تعيد التفكير.ولهذا تكمن نصيحة ايجي انتربرينور لك في محاولة التركيز على مزاياك الخاصة التي تتمتع بها بدلاً من تقليد لعبة خصمك التي يتميز بها في ملعبه الخاص، وذلك لا يكون إلا من خلال بذل جهودًا أكبر لتحسين نقاط القوة لديك، حيث تعتبر هذه الطريقة هي الأكثر فاعلية لتوفير الوقت وزيادة الموارد، كما يجب عليك إدراك أن  المستهلكين يعرفون ما الذي يجعل علامتك التجارية خيارًا أفضل بالنسبة لهم.يجب على أصحاب الشركات الناشئة عدم تجاهل ما يتميز به المنافسون في السوق، بجانب التركيز على تطوير علامتك التجارية ومعرفة ما يحتاجه المستهلكين.كيف ستعرف ما إذا كنت تستحوذ على حصة كبيرة من السوق أم لا، إذا كنت لا تراقب أرقامك وميزانياتك؟ لذا من المهم جداً متابعة أرقام شركتك والتكاليف، المبيعات، الإيرادات، الأسعار، حصص السوق، ومعرفة المكسب والخسارة.ولهذا يجب على الشركات الناشئة، معرفة موقعها وحجمها في السوق، ومدى وصول منتجاتك للمستهلكين، وماهي التكاليف اللازمة لتقديم أفضل خدمة ممكنة؟يقول لويس هاوز، المؤلف ورجل الأعمال الأكثر مبيعًا في صحيفة نيويورك تايمز: “العمل عبارة عن لعبة من البوصات حيث يمكن لأصغر ميزة أن تحدد مدى الفرق بين الفوز والخسارة”.من أساسيات التسويق الناجح معرفة من هو عميلك؟ حيث أن العميل وخدمته لابد أن يكونا على رأس أولويات الشركة، لأن العملاء هم رأس مال الشركة الأول الذي يمكن الشركة من الصعود للقمة أو الهبوط للقاع.لذا يجب عليك التأكد من ارضاء عملائك والاستماع لشكواهم ومقترحاتهم ومعرفة أفكارهم والاستجابة لها، مما يخلق لك الميزة التنافسية التي تجعل علامتك التجارية محببة للعملاء وأكثر مبيعًا.على سبيل المثال، المؤسس المشارك لشركة Tesla والرئيس التنفيذي Elon Musk. في محادثة قصيرة على وسائل التواصل الاجتماعي مع أحد مستخدمي Tesla ، يطمأنه ويقول له إن الشركة تستمع إلى المستهلكين وتهتم بهم، في غضون 24 دقيقة ، رد Musk على اقتراح مقدم من المستهلك ، مؤكدًا أنه سيتم تنفيذ طلباته في تحديث قادم.عليك أن تدرك جيدًا أنه لاتوجد شركة ناشئة بدأت في السوق مع قاعدة مستهلكين كبيرة ، وإنما تبدأ كل شركة أعمالها من الصفر ثم تبدأ في شق طريقها نحو النجاح أو الهبوط، وهكذا فعلت أكبر الشركات في العالم مثل  Facebook و Uber و Airbnb و Tesla و Virgin Atlantic، في التعامل مع عملائها من خلال معرفة رغباتهم وتحليل سلوكياتهم من خلال الـ Bid Data، ومعرفة ما تحتاجه كل فئة.يقول السير ريتشارد برانسون ، قطب الأعمال والمؤسس والرئيس التنفيذي لشركة فيرجن جروب: “بالنسبة لي، فإن بناء مشروع تجاري هو القيام بخلق شيء من شأنه أن يحدث فرقًا حقيقيًا في حياة الآخرين”.احصل على تنبيهات لحظية عبر جهازك عند رفع منشورات جديدة بالموقع. اشترك الآن!,https://www.egyentrepreneur.com/%d9%84%d9%84%d8%a8%d9%82%d8%a7%d8%a1-%d9%81%d9%8a-%d8%ae%d8%b6%d9%85-%d8%a7%d9%84%d9%85%d9%86%d8%a7%d9%81%d8%b3%d8%a9-%d8%a7%d9%84%d8%b4%d8%b1%d8%b3%d8%a9-%d9%83%d9%8a%d9%81-%d8%aa%d8%aa%d9%85%d9%83/,ريادة أعمال
كل ما تريد معرفته عن الرخصة الدولية لريادة الأعمال  «ILFEN»,تهدف الرخصة الدولية لريادة الأعمال  أوInternational license for Entrepreneurship أو اختصارًا ILFEN،  إلى قياس معرفة المتقدم بأساسيات إنشاء المشروعات.وتعكس رخصة ILFEN  مكانية أن يكون حامل هذه الرخصة قادراً على إنشاء عمل تجاري صغير، لاسيما يتم منحها لمن يجتاز الاختبار المعتمد من الجهة المانحة للرخصة والذي يعقد في مراكز معتمدة عبر العالم العربي.وتعتبر ILFEN رخصة معتمدة والتي تزودك بالمعرفة الضرورية لممارسة ريادة الأعمال في حياتك، بإمكانك الشعور بالثقة بأن فكرتك ستعرف طرق نقلها إلى اقتصاد واقعي.وتمنح الرخصة من جهات غير ربحية متخصصة في ريادة الأعمال للأشخاص، بعد تجاوزهم عدة اختبارات يقاس من خلالها المهارات الأساسية لإنشاء مشروع ناجح.ويمكن لأي شخص مهتم بمجال ريادة الأعمال أن يسجل في الامتحان عبر موقع الجمعية على الإنترنت.ويتم الاختبار بناء على منهج يمكن الحصول على نسخة تدريبية منه عبر الإنترنت أو في الأسواق.وفي حال حصولك على الرخصة، حينها أنت شخص مؤهل لإنشاء مشروع.يتوفر في المكتبات ودور النشر الحقائب التدريبية المعتمدة والتي تساعد على الاستعداد للاختباروتشرف على الرخصة أكاديمية ريادة الأعمال العربية بالتعاون مع جمعية ريادة الأعمال وجهات دولية متخصصة بريادة الأعمال.وتصل مدة الاختبار إلى ساعة ، ما يعني أن يكون متوسط كل سؤال يستغرق حوالي دقيقة، إلا أن  هناك أسئلة قصيرة لا تتطلب وقتاً طويلاً، وأخرى طويلة تستغرق ربما دقيقة للإجابة عليها، ووضع توقيت الاختبار بناءً على دراسات تبين متوسط الوقت الذي يحتاجه الشخص متوسط المهارة.هناك نوعين من الرخصة الأساسية والرخصة المتقدمة، على أن يكون على المنهج 100 ساعة بواقع 3 ساعات أسبوعيًا، لمدة 4 أشهر، وينتهي بعمل مشروع يحاكي المشروع الحقيقي.يتم الحصول على النتيجة خلال أسبوع من تاريخ إجراء الاختبار، وترسل النتيجة عبر ثلاثة وسائل هي :يوجد حاليًا مراكز منتشرة في كل من السعودية، مصر، السودان، الكويت، قطر، وسلطنة عمان، والأردن، وفلسطين.يعقد الاختبار في مراكز معتمدة 4 مرات في السنة : (يناير – مارس – يونيو – أكتوبر) ويحق للمتقدم دخول الاختبار مرتين في السنة فقط.رسوم الاختبار الرسمية هي 100 دولار أو ما يكافئها في العملات المحليةاحصل على تنبيهات لحظية عبر جهازك عند رفع منشورات جديدة بالموقع. اشترك الآن!,https://www.egyentrepreneur.com/%d9%83%d9%84-%d9%85%d8%a7-%d8%aa%d8%b1%d9%8a%d8%af-%d9%85%d8%b9%d8%b1%d9%81%d8%aa%d9%87-%d8%b9%d9%86-%d8%a7%d9%84%d8%b1%d8%ae%d8%b5%d8%a9-%d8%a7%d9%84%d8%af%d9%88%d9%84%d9%8a%d8%a9-%d9%84%d8%b1%d9%8a/,ريادة أعمال
توقيع اتفاق بين «السويدي» و«E4Impact» الإيطالية في مجال ريادة الأعمال,وقعت شركة السويدي إديوكيشن للخدمات التعليمية  اتفاقية تعاون في مجال ريادة الأعمال ، مع مؤسسة E4IMPACT الإيطالية .وأشار البروفيسور ماريو مولتيني الرئيس التنفيذي لمؤسسة E4IMPACT الإيطالية، إلى أن المؤسسة تعمل مع الشركات الناشئة لدعم نمو أعمالها وتقديم الشراكات والإرشاد وتوفير حلول الاتصال عبر أحدث التقنيات التكنولوجية لأعمالهم.وأوضح جامباولو كانتينى السفير الإيطالي ، اهتمامه بالاتفاقية معرباً عن إيمانه الشديد بالفرص المتميزة التي سيتم توفيرها للشباب ورواد الأعمال المصريين لتأسيس مشروعاتهم بنجاح من خلال توفير برامج بناء قدرات وتمويل الشباب ورواد الاعمال.وإمكانية زيادة رأس المال للشركات الناشئة من خلال التواصل مع الممولين، بالإضافة إلى تعزيز مستوى النظام الإيكولوجي لريادة الأعمال.ومن المقرر عقد سلسلة ندوات يبدأ أولها يوم 22 أبريل 2020، تحت عنوان “يوم ريادة الاعمال – للشباب الموهبين” بتنظيم كل من السويدي إديوكيشن والسفارة الإيطالية والهيئة العامة للاستثمار والمناطق الحرة ممثلة فيي مركز فكرتك شركتك ومؤسسة E4IMPACT بهدف تقديم مقترحات المشروعات المبتكرة لرواد الاعمال.وتشمل الندوات على دورات متميزة في مجال ريادة الاعمال والتعرف على احدث النظم الخاصة بدورة حياة المشروعات الناشئة وتعزيز التواصل مع مجتمع رجال الأعمال.سيتم اختيار أفضل المشروعات المطروحة للاستفادة ببرامج حاضنات ومسرعات النمو وكذا عقد مسابقات ريادة الأعمال، بالاضافة إلى تقديم خدمات تنمية الأعمال للمشروعات القائمة فى مراحلها المختلفة.وشهدت علا القبرصي نائب الرئيس التنفيذي للهيئة العامة للاستثمار والمناطق الحرة ، التوقيع بين إيهاب سلامة الرئيس التنفيذي لشركة السويدي إديوكيشن للخدمات التعليمية ، والبروفيسير ماريو مولتيني الرئيس التنفيذي لمؤسسة E4IMPACT الإيطالية ، بحضور كل من المهندس أحمد السويدي رئيس مجلس الإدارة ، وجامباولو كانتينى السفير الإيطالي بجمهورية مصر العربيةورصدت مؤسسة السويدي إديوكيشن، 7 مليارات لمشروع جامعات المعرفة الدولية في العاصمة الإدارية، الذي يقام على 5 مراحل تستغرق ما بين 7 إلى 10 سنوات. هي  مبادرة أطلقتها ALTIS – كلية الدراسات العليا في إدارة الأعمال والمجتمع في جامعة كاتوليكا ديل ساكرو كور ، بهدف تدريب رواد الأعمال المؤثرين في العالم النامي لدعم بدء أعمالهم ونموها.ويقع مقرها في ميلانو – إيطاليا حيث قامت بتقديم برامج تنمية القدرات في 13 دولة أفريقية وقامت بتدريب عدد يتخطى 1000 من رواد أعمال.في عام 2015 ، أصبحت E4Impact مؤسسة بدعم من Securfin و Mapei و Salini-Impregilo و Università Cattolica del Sacro Cuore و Always Africa Association. في وقت لاحق ، انضمت إيني و Lisa Spa و Intesa Sanpaolo و VueTel إلى E4Impact كمشاركين في الشركات و Diana Bracco و Michele Carpinelli كمشاركين فرديين.احصل على تنبيهات لحظية عبر جهازك عند رفع منشورات جديدة بالموقع. اشترك الآن!,https://www.egyentrepreneur.com/%d8%aa%d9%88%d9%82%d9%8a%d8%b9-%d8%a7%d8%aa%d9%81%d8%a7%d9%82-%d8%a8%d9%8a%d9%86-%d8%a7%d9%84%d8%b3%d9%88%d9%8a%d8%af%d9%8a-%d9%88e4impact-%d8%a7%d9%84%d8%a5%d9%8a%d8%b7%d8%a7/,ريادة أعمال
مصر تستحوذ على 27% من صفقات التمويل الشركات الناشئة بالشرق الأوسط خلال2019,كشف تقرير مؤسسة ماجنيت للأبحاث إن النظام التكنولوجي للشركات الناشئة ينمو بشكل سريع في الشرق الأوسط وشمال إفريقيا مع وجود 517 مليون دولار تم استثمارها في 354 صفقة في أول 9 أشهر من العام الجاري.وأظهر تقرير مؤسسة ماجنيت أن الشركات حققت نمو 30 % فى قيمة التمويلات و 3 % فى عدد الصفقات المبرمة عن الفترة ذاتها من 2018، مشيرًا إلى أن شركات التكنولوجيا سيطرت على العدد الأكبر من صفقات التمويل المبرمة.وتصدرت مصر قائمة الدول الأكثر إبراما لصفقات التمويل بنسبة بلغت 27 %، صفقات التمويل للشركات الناشئة خلال التسعة أشهر الأولى من 2019، تلتها الإمارات العربية المتحدة بحوالي 25% من عمليات التمويل والتي بلغت حوالي 354 صفقة تمويلية.أشار التقرير أن مصر استحوذت على 13% من حجم التمويلات للشركات الناشئة في الشرق الأوسط، بقيمة “67.2 مليون دولار” حوالي “مليار جنيه” ووفقًا للتقرير نفسه بلغ حجم التمويلات حوالي 517 مليون دولار منذ بداية العام وحتى الآن.وجاءت لبنان في المرتبة الثالثة من حيث عدد الصفقات التي تم إبرامها خلال الأرباع الثلاثة الأولى من العام ثم السعودية وتونس بنسب 9%، و5% على التوالي.استحوذت قطاعات التكنولوجيا المالية والتجارة الإلكترونية على 24% من عدد الصفقات، وسيطر قطاع التوصيل والنقل على 8% من الصفقات، بينما الأغذية والمشروبات حازت على 7% من التمويلات وأخيرًا حلول التكنولوجيا المالية بنسبة 6%.وجاءت شركة “مكسب” المصرية المتخصصة في التجارة الإلكترونية وحلول التكنولوجيا المالية كأكبر صفقة تمويلية خلال الربع الثالث من العام الجاري حيث حصلت على جولة تمويلية بقيمة 6.2 مليون دولار كتمويل أولي من خلال مجموعة من المستثمرين تضم 500 ستارت أبس، وبيكو، وأوتلايرز، وإندور.احصل على تنبيهات لحظية عبر جهازك عند رفع منشورات جديدة بالموقع. اشترك الآن!,https://www.egyentrepreneur.com/%d9%85%d8%b5%d8%b1-%d8%aa%d8%b3%d8%aa%d8%ad%d9%88%d8%b0-%d8%b9%d9%84%d9%89-27-%d9%85%d9%86-%d8%b5%d9%81%d9%82%d8%a7%d8%aa-%d8%a7%d9%84%d8%aa%d9%85%d9%88%d9%8a%d9%84-%d8%a7%d9%84%d8%b4%d8%b1%d9%83/,ريادة أعمال
