Title,Content,Link,Category
النسخة الثانية من مسابقة ” جائزة ريادة الأعمال الأفريقية “,أطلق البنك المغربى للتجارة الخارجية بإفريقيا النسخة الثانية من فعاليات جائزة ريادة الأعمال الأفريقية (AEA) التى تدعم رواد الأعمال المبدعين فى أفريقيا. ويعكس إطلاق جائزة ريادة الأعمال الأفريقية والتى أعلن عنها للمرة الأولى فى نوفمبر 2014 عثمان بن جلون رئيس مجموعة البنك المغربى للتجارة الخارجية طموح المجموعة لدعم ريادة الأعمال فى أفريقيا من خلال مكافأة المبتكرين.كما تهدف هذه المبادرة إلى دعم رواد الأعمال الأفارقة أو ذوى الأصول الإفريقية وحثّهم على تجاوز قدراتهم لأنهم يتمتعون بالموهبة وبأفكار تبشر بغد أفضل للقارة، وترصد الجائزة الأفريقية لريادة الأعمال مبلغ مليون دولار أمريكى سنويا لمكافأة أفضل رواد الأعمال الأفارقة فى ثلاث فئات هى التعليم، البيئة، والمجالات غير المسبوقة فى أفريقيا.ويأتى انطلاق النسخة الثانية من الجائزة الإفريقية لريادة الأعمال تتويجا للنجاح الكبير الذى حققته النسخة الأولى والتى جمعت أكثر من 5000 طلب للمشاركة من جميع الدول الإفريقية الأربع والخمسين، وستستمر عملية التسجيل للمشاركة فى النسخة الثانية حتى يوم الجمعة 6 مايو.ويعقب الخطوة الأولى التى ستسمح بجمع الأفكار الأكثر إفادة للمنطقة خطوتان إضافيتان: الأولى هى الطلب من المتقدمين الناجحين الترويج لمشاريعهم عن طريق تقديم عروض مقنعة قبل عملية الاختيار النهائية التى ستشيد بالمشاريع الأكثر إبداعًا واستدامةً.يتم ترشيح المشاريع بمساعدة شركاء ريادة الأعمال فى أفريقيا، بما فى ذلك رواد الأعمال، والأكاديميين، والقادة، والمستشارين من كل أرجاء العالم؛ وسيقومون بمساعدة المرشحين فى كل خطوة من خطوات المسابقة.للتقدم للمسابقة و الجائزة إضغط هنـــــــــــــــــــاالمصدر :: ASTF,https://preneur-masr.com/news/%d8%a7%d9%84%d9%86%d8%b3%d8%ae%d8%a9-%d8%a7%d9%84%d8%ab%d8%a7%d9%86%d9%8a%d8%a9-%d9%85%d9%86-%d9%85%d8%b3%d8%a7%d8%a8%d9%82%d8%a9-%d8%ac%d8%a7%d8%a6%d8%b2%d8%a9-%d8%b1%d9%8a%d8%a7%d8%af%d8%a9-%d8%a7/,ريادة أعمال
الإمارات ال 19 عالمياً في ريادة الأعمال,حصلت دولة الإمارات العربية المتحدة على المركز الـ 19 عالمياً في ” تقرير المؤشر العالمي لريادة الأعمال 2016 ” متقدمة على دول معهود لها في عملية دعم ريادة الأعمال والرواد مثل النرويج وكوريا الجنوبية وتركيا واليابان فيما كانت تحتل المركز الـ 20 العام الماضي.و تصدرت الإمارات قائمة الدول ضمن إقليم الشرق الأوسط وشمال أفريقيا التي تشمل 15 دولة من ضمنها تركيا.وبين تحليل أعده فريق عمل الهيئة الاتحادية للتنافسية والاحصاء حول أداء دولة الإمارات في “تقرير المؤشر العالمي لريادة الأعمال”2016 تقدم الدولة في عدد من المؤشرات والمحاور في التقرير السنوي الذي يصدره المعهد العالمي للريادة والتنمية ومقره في العاصمة الأمريكية واشنطن.ويقيم التقرير 132 دولة مستندا إلى 14 محوراً أساسياً منها ::1-انطباع الفرص2- مهارات التأسيس3- تقبل المخاطر4- التواصل والدعم الثقافي5- فرص التأسيس6- استيعاب التكنولوجيا7- رأس المال البشري8- المنافسة والابتكار في المنتج9- الابتكار في الإجراء10- النمو العالي11- التدويل12- رأس المال المخاطر.وأعرب عبد الله ناصر لوتاه مدير عام الهيئة الاتحادية للتنافسية والاحصاء في تصريح صحافي له اليوم عن تطلع الهيئة إلى تحقيق أداء أفضل في تقرير عام 2017.وجاءت الإمارات ضمن المرحلة الأعلى “Top Quantile ” التي تشمل أفضل 26 دولة في العالم تتقدمها الولايات المتحدة الأمريكية.المصدر :: الشارقة 24تعلق برينور- مصر ::1- اخلص التهاني لشعب دولة الإمارات العربية المتحدة الشقيق علي هذا الإنجاز الكبير و العام القادم تكونون في مكانة أعلي بإذن الله.2- ما حققتة الإمارات هو نتيجة طبيعية لتوافر الرؤية و الإرادة و العنصر البشري و المال.3- شرفتونا يا إمارتيين.,https://preneur-masr.com/news/%d8%a7%d9%84%d8%a5%d9%85%d8%a7%d8%b1%d8%a7%d8%aa-%d8%a7%d9%84-19-%d8%b9%d8%a7%d9%84%d9%85%d9%8a%d8%a7%d9%8b-%d9%81%d9%8a-%d8%b1%d9%8a%d8%a7%d8%af%d8%a9-%d8%a7%d9%84%d8%a3%d8%b9%d9%85%d8%a7%d9%84/,ريادة أعمال
تعاون بين تحديث الصناعة و كلية الفنون التطبيقية,وقع كلاً من م / أحمد طه المدير التنفيذي لمركز تحديث الصناعة IMC – و – الدكتور جورج نوبار عميد كلية الفنون التطبيقية بجامعة حلوان بروتوكول تعاون مشترك بينهما بهدف دعم و تنمية الصناعة المصرية بمختلف قطاعاتها خاصة المتوسطة و الصغيرة و المتناهية الصغر مثل الورش الصناعية .و ذكر م / أحمد طه أن البروتوكول يستهدف خلق مجالات تعاون لرفع كفاءة قطاع الصناعة و تحسين إنتاجيتها و النهوض بجودة منتجاتها ، و تشمل مجالات التعاون ::1- تقديم الإستشارات الفنية من المصممين بأقسام الكلية المختلفة للمستفدين من خدمات مركز تحديث الصناعة.2- تقديم مركز تحديث الصناعة للمعلومات و المستجدات الخاصة بريادة الأعمال لتعليمها لطلاب كلية الفنون التطبيقية.3- عرض منتجات طلاب كلية الفنون التطبيقية المتميزة في معرض ” مصر الإبداع “.4- تقديم كلية الفنون التطبيقية لخدمات الدعم الفني  و ورش العمل و دورات التوعية الفنية لصغار المصنعين و الحرفيين المستفيدين من خدمات مركز تحديث الصناعة.جزء من محتوي الخبر مصدره :: الأهرام,https://preneur-masr.com/news/%d8%aa%d8%b9%d8%a7%d9%88%d9%86-%d8%a8%d9%8a%d9%86-%d8%aa%d8%ad%d8%af%d9%8a%d8%ab-%d8%a7%d9%84%d8%b5%d9%86%d8%a7%d8%b9%d8%a9-%d9%88-%d9%83%d9%84%d9%8a%d8%a9-%d8%a7%d9%84%d9%81%d9%86%d9%88%d9%86-%d8%a7/,ريادة أعمال
وزارة الإتصالات :: زيادة إستثمارات ريادة الأعمال ل 9 مليار جنيه,تعكف وزارة الاتصالات وتكنولوجيا المعلومات المصرية حالياً على وضع خطة جديدة تستهدف زيادة استثمارات ريادة الأعمال والحاضنات التكنولوجية بالسوق المحلى خلال 5 سنوات، لتصل إلى 9 مليارات جنيه بحيث يتناسب مع متطلبات هذه الصناعة ومعدلات نموها.ووفقاً لمسئول حكومى فإن الوزارة وضعت ريادة الأعمال والإبداع التكنولوجى ضمن أهدافها الاستراتيجية منذ عامين ورصدت له ما يقرب من 8 مليارات جنيه لكنه وفقاً للخطة الجديدة فإن الاستثمارات اللازمة للإبداع وريادة الأعمال ستقفز إلى 9 مليارات جنيه نتيجة النمو الكبير الذى تشهده هذه الصناعة.وبحسب الخطة فإن الوزارة ستعتمد على المستثمرين فى توفير ما يقرب من %60 من ميزانية الخطة فى حين توفر الهيئات المانحة حوالى 1.5 مليار جنيه وتتولى الهيئات التابعة للوزارة إتاحة باقى الدعم اللازم.وتسعى وزارة الاتصالات للترويج لمشروعات ريادة الأعمال أمام القطاع الخاص لجذب تمويلات بنسبة %60 من الاستثمارات المستهدفة والمقدرة بواقع 9 مليارات جنيه وذلك من خلال تدشين حاضنات أعمال وصناديق استثمار متخصصة فى التكنولوجيا.وتوفر الوزارة، حالياً برامج دعم الإبداع للمدارس والجامعات للوصول للطلبة المبدعين فى مجالات الاتصالات وتكنولوجيا المعلومات وإتاحة الإمكانيات لهم عبر حاضنات بالإضافة إلى توفير الإمكانيات والدعم للشركات الناشئة فى ريادة الأعمال عبر مركز الإبداع التكنولوجى.أشار المصدر إلى أن مركز الإبداع التكنولوجى (TIEC) التابع للوزارة والمعنى بريادة الأعمال يطلق بصورة مستمرة برنامج “InnovEgypt”، المتخصص فى مجال الابتكار وريادة الأعمال والموجه لطلاب السنة الثالثة من الجامعات المصرية فى تخصصات تكنولوجيا المعلومات والاتصالات الذين يطمحون أن يصبحوا مبتكرين وأصحاب مشاريع فى المستقبل إما من خلال إنشاء شركة خاصة أو بتعزيز المهارات المطلوبة من قبل الشركات المحلية أو العالمية.ويهدف برنامج “ InnovEgypt ” لإنشاء قاعدة من الكوادر المصرية المؤهلة من المبتكرين وأصحاب المشاريع من خلال توفير التدريب على نطاق واسع فى مجال الابتكار وإدارة التكنولوجيا وريادة الأعمال للطلاب الجامعيين.وتتمثل الأهداف الرئيسية للبرنامج فى تقديم المعلومات الأساسية للابتكار وإدارة التكنولوجيا، وتوعية الطلاب بأهمية حماية الابتكار من خلال حقوق الملكية الفكرية والموضوعات ذات الصلة وتمكين الطلاب من ابتكار الأفكار باستخدام منهجيات علمية وتطوير مهارات ريادة الأعمال من خلال تقديم المفاهيم والتطبيق العملى التفاعلى لاستخدام الأدوات الأساسية اللازمة لبدء أعمال تجارية جديدة.المصدر :: المؤسسة العربية للعلوم و التكنولوجياتعليق برينور – مصر ::1- الخبر رائع بكل تأكيد و هو جرس ينبه الوزارات المختلفة و المنظمات الموجودة بالمجتمع لما تقدم عليه وزارة الأتصالات و تكنولوجيا المعلومات و الجميع يعرف أن قطاع الإتصالات و تكنولوجيا المعلومات هو أكثر قطاع في مصر يحافظ علي وجود نمو به حتي السنوات التي تلت ثورة 25 يناير المجيدة كان القطاع يحقق نمواً يدور حول نسبة 10%  سنوياً و هي نسبة جيدة للغاية في ظل الأوضاع القوية التي مرت بها مصرنا الحبيبة.2-  إعلان الوزارة لما ستقدم عليه هو إشارة إلي أهمية هذا القطاع.3- هل لدي الوزارات الأخري خطة أو حتي رؤية لما تستطيع ريادة الأعمال تنفيذه بكل وزارة علي حده . و بالأخص وزارتي الصناعة و الزراعة ؟4- الخبر فرصة لكل العاملين بقطاع الإتصالات و تكنولوجيا المعلومات لأن الوزارة حينما تضع مشروعات تحتاج لموردين و مقاولي باطن و إستشاريين و المشروعات الصغيرة لها نصيب من مناقصات هذه المشروعات طبقاً للقانون. هل من رائد أعمال واثق في نفسه و منتجه يستطيع إغتنام جزء من هذه المشروعات ؟,https://preneur-masr.com/news/%d9%88%d8%b2%d8%a7%d8%b1%d8%a9-%d8%a7%d9%84%d8%a5%d8%aa%d8%b5%d8%a7%d9%84%d8%a7%d8%aa-%d8%b2%d9%8a%d8%a7%d8%af%d8%a9-%d8%a5%d8%b3%d8%aa%d8%ab%d9%85%d8%a7%d8%b1%d8%a7%d8%aa-%d8%b1%d9%8a%d8%a7%d8%af/,ريادة أعمال
ختام البرنامج التدريبي ل اليونيدو لمدربي ريادة الأعمال,"أختتم اليوم الخميس 4 فبراير 2016 البرنامج التدريبي الذي أقامته منظمة الأمم المتحدة للتنمية الصناعية ” اليونيدو ” لمدربي ريادة الأعمال المصريين و الذي أقيم بالتعاون مع المكتب العربي الدولي لريادة الأعمال التابع لمكتب اليونيدو في مملكة البحرين و الصندوق الإجتماعي للتنمية.و كانت منظمة اليونيدو قد نظمت البرنامج التدريبي لرفع كفاءة و مهارات مدربي ريادة الأعمال المصريين للإستفادة من وجود خطط كثيرة طموحة لنشر فكر العمل الحر بين المصريين من قبل الحكومة المصرية و المنظمات العالمية مثل الأمم المتحدة و منظماتها المنبثقة عنها مثل اليونيدو.و قد وضح خلال البرنامج التدريبي مدي الإهتمام بريادة الأعمال في مصر و ذلك من خلال تحدث الدكتور هاشم سليمان مدير مكتب اليونيدو بالبحرين و مدير المركز العربي الدولي لريادة الأعمال الذي قال أن هذا البرنامج ما هو إلا بداية لآن بلد مثل مصر تعدادها 90 مليون نسمة و تمتلك كفاءات بشرية نعرفها جيداً في البحرين و يشهد عليها العالم أجمع لذا لآبد أن يكون بها خطط طموحة أكثر مما هي موجودة للإستفادة من عقول المصريين و الموارد التي حبا الله بها مصر خاصة و أن مصر قد نفضت الغبار عن نفسها بثورتين عظيمتين. كما دعا إلي التعلم من تجارب رواد و رائدات العمال الناجحين بالعالم العربي و ضرب مثال برائداتين اعمال من البحرين هما السيدة هدي جناحي و السيدة نوال الصباغ اللتان تعدان قصتي نجاح لآبد ان يتعلم منهما الجميع (  سوف نعرض في برينور – مصر قصتي نجاحهما قريباً )ثم تحدث الدكتور رأفت شحاته الأمين العام للإتحاد العربي للمشروعات الصغيرة و مدير المكتب الفني بالصندوق الإجتماعي للتنمية و قال أن الخطط الموضوعة في مصر لزيادة الأستفادة من ريادة الأعمال لابد ان تتكامل بالتشبيك بين المؤسسات و بعضها البعض حتي تأتي ريادة الأعمال بمفعولها و يلمسه الناس خاصة أنه خلال من عمله بالصندوق يري أن المؤسسات الكثيرة التي تعمل علي علي نشر ثقافة العمل الحر و ريادة الأعمال مثل جمعية رجال الأعمال بالأسكندرية لابد أن تتكامل خططها و سياساتها مع بعضها البعض مع إعطاء الحرية الكاملة لكل مؤسسة في أن تنفذ خططها بالطريقة التي تناسبها و لكن أن تكون في إطار نفس السياسة و الخطة الموضوعة للمشروعات الصغيرة ككل في مصر حتي يحس و يدرك الناس بمردود ريادة الأعمال في مصر.و بعد ذلك المهندس أحمد الجندي المسئول الأول عن ريادة الأعمال في الصندوق الإجتماعي للتنمية و الذي ذكر أن الخدمات غير المالية كان الأصل في خدمات الصندوق و أن الخدمات المالية و الإقراض أتت بعد ذلك حيث أنهم كانوا يقرضون الناس من خلال البنوك و ليس من خلالهم و أن عملهم الرئيسي كان تقديم الخدمات الغير مالية مثل الإرشاد و التوجيه و أن إدارة ريادة الأعمال بالصندوق مؤسسة به منذ عام 1996 تحت مسمي مختلف و أنه تم تعديل اسم الإدارة منذ عدة سنوات قليلة و أنه بهذا يعرف الناس أن ريادة الأعمال و فكر العمل الحر موجود بالصندوق منذ فترة طويلة .و أخيراً تم توزيع الشهادات علي المتدربين من مدربي ريادة الأعمال المصريين و هم مقسمين بين موظفي الصندوق الإجتماعي للتنمية ، و مؤسسات المجتمع المدني و منهم مؤسسة آل قرة بسوهاج و قنا و الجمعية المصرية للطاقة المتجددة و البيئة  ، و القطاع الخاص و منهم CDO  و أكاديمية العلوم للتدريب و الإستشارات بسوهاج و برينور – مصر.
",https://preneur-masr.com/news/%d8%ae%d8%aa%d8%a7%d9%85-%d8%a7%d9%84%d8%a8%d8%b1%d9%86%d8%a7%d9%85%d8%ac-%d8%a7%d9%84%d8%aa%d8%af%d8%b1%d9%8a%d8%a8%d9%8a-%d9%84-%d8%a7%d9%84%d9%8a%d9%88%d9%86%d9%8a%d8%af%d9%88-%d9%84%d9%85%d8%af/,ريادة أعمال
المرصد الإقتصادي يستضيف برينور – مصر,تستضيف الإذاعية اللامعة / مني منير مقدمة و معدة برنامج المرصد  الإقتصادي الذي يذاع علي شبكة إذاعة البرنامج الثقافي بالإذاعة المصرية الأستاذ / أحمد الخولي مؤسس و مدير موقع برينور – مصر اليوم الخميس 21 يناير 2016 في حوار جديد آخر علي الهواء مباشرة . يبدأ اللقاء في تمام الساعة السابعة و النصف مساءً و حتي الساعة الثامنة و النصف مساءً .و في هذه الحلقة تقوم الإعلامية / مني منير بمناقشة أ / أحمد الخولي في بعض النقاط بمجال ريادة الأعمال في مصر كما سيكون بإمكان زوار برينور – مصر توجيه الأسئلة التي يريدونها من خلال الإتصال بالهاتف الذي سيذكر أثناء الحلقة و يمكنكم كذلك طرح الأسئلة التي تريدون الإجابة عنها من خلال إرسالها لنا علي بريدنا الإليكتروني بصفحة ” إتصل بنا ” أو من خلال صفحتنا أو حسابنا علي مواقع التواصل الإجتماعي ” فيس بوك ، تويتر ، لينكد إن ، جداري / تشينو ” . آخر وقت يسمح فيه بإستقبال أسئلتكم هو الساعة السادسة من مساء اليوم.للإستماع إلي اللقاء  ::1- من خلال الراديو :: علي التردد 91.5 علي شبكة إف إم.2- من خلال الريسيفر :: علي تردد 11766.3- من خلال الإنترنت :: علي موقع إتحاد الإذاعة و التليفزيون – قطاع الإذاعة – إذاعة البرنامج الثقافي و رابط موقع الإذاعة المصرية  هو http://ertu.org/1/radiothakafya.aspملحوظة :: قم بعمل تحميل لبرنامج تشغيل الموقع  Plug in.مع أطيب تمنياتنا لكم بالإستماع بحلقة مفيدة,https://preneur-masr.com/news/%d8%a7%d9%84%d9%85%d8%b1%d8%b5%d8%af-%d8%a7%d9%84%d8%a5%d9%82%d8%aa%d8%b5%d8%a7%d8%af%d9%8a-%d9%8a%d8%b3%d8%aa%d8%b6%d9%8a%d9%81-%d8%a8%d8%b1%d9%8a%d9%86%d9%88%d8%b1-%d9%85%d8%b5%d8%b1-2/,ريادة أعمال
أسماء المشروعات الفائزة في برنامج ” إنطلاق “,السادة زورا موقع برينور – مصر ننشر أسماء المشروعات التي أعلن عن قبولها كدفعة أولي في البرنامج القومي للحاضنات التكنولوجية في دورته الأولى والذي يتم بالتعاون بين أكاديمية البحث العلمي و هيئة الاستثمار ممثلة في حاضنة الأعمال ” مركز بداية للشركات الناشئة ” طبقاً لما ورد لنا من وزارة الإستثمار و هي  ::المشرع الأول :: قابس – مدحت محمود.المشروع الثاني :: Nilebot – أحمد خالد.المشروع الثالث :: نانو فيب تك – وائل ممدوحالمشروع الرابع :: Using Mobile Augmented  Reality For Interactive  Education – إبراهيم العترالمشروع الخامس :: Lamina – محمد الهاشمي.المشروع السادس :: Green Sky – أحمد المرسي.المشروع السابع :: Nano Ebers – حسن العزازي.المشروع الثامن :: اكوا فوتون – معتز طارق.المشروع التاسع :: Bubble – إيهاب مصطفي.المشروع العاشر :: Pisos – معتز الخولي.المشروع الحادي عشر :: Easy Electonics for Kids – دعاء سعيد.خالص تهانينا للمشاريع الفائزة بالإلتحاق بالبرنامج و دعواتنا لكم بتكملة نصف المشوار نحو تنفيذ أحلامكم و مشاريعكم التي تقاتلون من أجل تحقيقها- الله معكم و يوفقكم.,https://preneur-masr.com/news/%d8%a3%d8%b3%d9%85%d8%a7%d8%a1-%d8%a7%d9%84%d9%85%d8%b4%d8%b1%d9%88%d8%b9%d8%a7%d8%aa-%d8%a7%d9%84%d9%81%d8%a7%d8%a6%d8%b2%d8%a9-%d9%81%d9%8a-%d8%a8%d8%b1%d9%86%d8%a7%d9%85%d8%ac-%d8%a5%d9%86%d8%b7/,ريادة أعمال
كلمة أخيرة عن رايز اب 2015,48 ساعة هي مدة مؤتمر رايز اب لعام 2015 تم فيها عقد مالا يقل عن 100 ورشة عمل و ندوة و حلقة نقاشية و مسابقات . فلو أننا حسبنا مجموع أوقات هذه الفعاليات لوجدناها تزيد عن 5 أيام تدريب متواصل بما يعادل 120 ساعة.لقد اجاد حقاً فريق عمل رايز اب هذا العام لدرجة تجعلني و تجعل كثيرين يتسألون  :: كيف سيكون رايز اب 2016 ؟ فما تم تقديمه في رايز اب 2015 من تنظيم و تنسيق و حفل ختامي رائع بكل المقاييس يجعلني اشعر بالشفقة علي فريق عمل رايز اب لآنهم سيتعبون جداً في إيجاد أفكار جديدة يخرجون بها علينا في رايز اب 2016.فبعدما أثاروا إعجاب الكثيرين بحسن التنظيم و دقته  – و الأفكار الجديدة في العروض – و مستوي الشخصيات التي جاءت من شتي بقاع الأرض  -للتحدث في المؤتمر – و حجم و عدد ورش العمل و الندوات و المسابقات التي نظمت في يومين فقط -ثم كان حفل الختام هو درة التـــــــــــــاج للمؤتمر و مثلما نقول في مصر ” كان ختامها مسك “.و رغم كل ما ذكر إلا أن بداخلي ثقة ان فريق العمل الذي نفذ كل هذا لهو قادر علي إبهارنا و إمتاعنا في رايز 2016 بحيث لا يقل عن رايز اب 2015.و في النهاية لا يسعنا إلا أن نقول لفريق عمل رايز اب ::أحسنتم و أجدتم و اثبتم ان شركة صغيرة مصرية تستطيع أن تنفذ مؤتمراً هاماً مثل رايز اب و ننتظر بشوقرايز اب 2016,https://preneur-masr.com/news/%d9%83%d9%84%d9%85%d8%a9-%d8%a3%d8%ae%d9%8a%d8%b1%d8%a9-%d8%b9%d9%86-%d8%b1%d8%a7%d9%8a%d8%b2-%d8%a7%d8%a8-2015/,ريادة أعمال
