Title,Content,Link,Category
برنامج YEP من أمديست و سيتي بنك لريادة الأعمال,"أعلنت مؤسسة أمديست و مؤسسة سيتي التابعة لبنك سيتي Citi Bank عن برنامجهما المسمي YEP المتخصص في تدريب و تطوير مهارات رواد الأعمال . البرنامج مدته ستة أشهر مع سنة من التوجيه و الإرشاد .التعريف ب أمديست و مؤسسة سيتي ::1- أمديست Amideast ::أمديست هي هيئة أمريكية رائدة غير هادفة الربح تعمل في مجال التعليم والتدريب الدولي وأنشطة التنمية في منطقة الشرق الأوسط وشمال إفريقيا. وتعمل أمديست بصفة متواصلة في مصر منذ أكثر من 50 عاما. وتقدم أمديست من خلال مكاتبها الرئيسية في القاهرة والإسكندرية برامج وخدمات للمصريين المهتمين باستكشاف فرص الدراسة في الخارج، وتعزيز مهارات التواصل والإدارة للترقي الشخصي والمهني. وتقوم أمديست بتنفيذ برامج ريادة الأعمال في منطقة الشرق الأوسط وشمال أفريقيا منذ عام 2011.رابط موقع أمديست http://www.amideast.org/ar2- مؤسسة سيتي Citi Foundation ::تعمل مؤسسة سيتي على تشجيع النمو الإقتصادي وتحسين مستوى معيشة محدودي الدخل حول العالم. حيث تقوم بالإستثمار في الجهود التي تؤدي الى زيادة الإدماج المالي وتوفير المزيد من فرص العمل للشباب وإعادة تطوير أساليب لبناء مدن نابضة إقتصاديا. ومنهجية مؤسسة سيتي “أكثر من عطاء” مبنية على خبرات سيتي الواسعة وخبرات العاملين بها من أجل تحقيق رؤيتنا وقيادتنا الرشيدة وابتكارنا. لمزيد من المعلومات يرجى زيارة موقعنا www.citifoundation.comشروط الإنضمام للبرنامج ::1- أن يكون المتقدم مصري الجنسية .2- العمر من 18 – 30 سنة .3- أن تكون فكرة المشروع مدروسة جيداً أو تم إتخاذ خطوات فعلية بخصوصها .4- أن يكون فريق عمل المشروع مكون من 2 إلي 5 أفراد .5- أن تكون فكرة المشروع مبتكرة و تهدف للتنمية في مصرلمعرفة باقي شروط الإنضمام يمكنكم زيارة موقع البرنامج علي الرابط التالي :: http://www.amideast-yep.org/ar/
",https://preneur-masr.com/news/%d8%a8%d8%b1%d9%86%d8%a7%d9%85%d8%ac-yep-%d9%85%d9%86-%d8%a3%d9%85%d8%af%d9%8a%d8%b3%d8%aa-%d9%88-%d8%b3%d9%8a%d8%aa%d9%8a-%d8%a8%d9%86%d9%83-%d9%84%d8%b1%d9%8a%d8%a7%d8%af%d8%a9-%d8%a7%d9%84%d8%a3/,ريادة أعمال
برنامج ” الإبتكار لرواد الأعمال في الصناعات الإبداعية “,"أعلن مجلس الصناعة للتكنولوجيا والابتكار التابع لوزارة التجارة والصناعة المصرية عن فتح باب التقديم في برنامج” الابتكار لرواد الأعمال المصريين الراغبين في النمو في مجال الصناعات الإبداعية “البرنامج بالتعاون مع البرنامج المصري الألماني للترويج للمشروعات الصغيرة والمتوسطة (أحد البرامج المنفذة من قبل الوكالة الألمانية للتعاون GIZ) وممول من أكاديمية البحث العلمي والتكنولوجياالصناعات الإبداعية يشير لها البرنامج هي ::1-  الأزياء2-  المجوهرات والاكسسوارات3- الجلود4-  الملابس الجاهزة هذه الصناعات الإبداعية مرتبطة بالصناعات التقليدية والتراثية في مصر. وتتأثر هذه الصناعات باستمرار تغيير الأذواق. حيث أن آراء المستهلكين تزداد تعقيداً كونها تتشكل تبعاً للاتجاهات المحلية، الإقليمية والعالمية. ومن أجل الحفاظ على قدرتها التنافسية وقدرتها على الاستمرار، تحتاج الشركات الحديثة للابتكار لمواكبة هذه المتغيرات.
وبالتالي فإن هناك عدد قليل من العلامات التجارية المحلية تعمل على الجوانب الصناعية والتجارية للمساهمة في نمو الاقتصاد المحلي والتي تتبع معايير تجارية تتميز بالإبداع والجودة وفقا لمعايير الموضة العالميةسيتم تقديم تدريب مكثف حول التكنولوجيا والابتكار التجاري لمجموعة مختارة من رواد الأعمال والشركات المصرية الناشئة. الهدف الرئيسي هو تقديم خدمة دعم فني وتقني في مجالات التكنولوجيا والابتكار وريادة الأعمال والتي سوف تساعد رواد الأعمال لبدء عمل تجاري مرخَص في مجالات الملابس الجاهزة، والمنتجات الجلدية والمجوهرات والإكسسوارات. هذه الأعمال بالتالي سوف تقدم وظائف لائقة وتملئ الثغرات في سلاسل الإمداد.التدريب يتبع 3 قطاعات لبرنامج الحضانة: الملابس الجاهزة (RTW) ، المجوهرات والاكسسوارات، ومنتجات الجلود. يكون هذا الاحتضان بمثابة دعم للشركات الناشئة لبدء تقديم العلامة التجارية الخاصة بهم في هذه المجالات بناءً على حاجة السوق.لمزيد من المعلومات حول آلية التقديم و من يمكنه التقديم إضغط علي الرابط التالي :: هنـــــــــــا أقصى موعد للتقديم 7 من يناير 2017
",https://preneur-masr.com/news/%d8%a8%d8%b1%d9%86%d8%a7%d9%85%d8%ac-%d8%a7%d9%84%d8%a5%d8%a8%d8%aa%d9%83%d8%a7%d8%b1-%d9%84%d8%b1%d9%88%d8%a7%d8%af-%d8%a7%d9%84%d8%a3%d8%b9%d9%85%d8%a7%d9%84-%d9%81%d9%8a-%d8%a7%d9%84%d8%b5%d9%86/,ريادة أعمال
مسرعة أعمال الجامعة الأمريكية تفتح أبواب دورتها الثامنة,أعلنت مسرعة الأعمال بالجامعة الأمريكية بالقاهرة AUC Venture Lab عن فتح باب التقدم لدورتها الثامنة . لذا علي كل من لديه فكرة مشروع أو لديه مشروع قائم و يريد تطويره فعليه التقدم الآن.رابط التقدم و الإلتحاق هو :: https://www.f6s.com/aucventurelab/applyيمكنكم توجيه الأسئلة و الإستفسارات للمسرعة من خلال مواقع التواصل الإجتماعي ::الفيس بوك :: إضغط هنـــــــــــــاتويتر :: @AUC_Vlabآخر موعد للتقدم هو يوم الأحد 9 يناير2017ملحوظة :: مسرعة الأعمال AUC VL لن تحصل علي أي نسبة في الشركات التي ستساهم في نشأتها أو تطويرها كما هو معتاد في مسرعات الأعمال الأخري .موفقين بإذن الله,https://preneur-masr.com/news/%d9%85%d8%b3%d8%b1%d8%b9%d8%a9-%d8%a3%d8%b9%d9%85%d8%a7%d9%84-%d8%a7%d9%84%d8%ac%d8%a7%d9%85%d8%b9%d8%a9-%d8%a7%d9%84%d8%a3%d9%85%d8%b1%d9%8a%d9%83%d9%8a%d8%a9-%d8%aa%d9%81%d8%aa%d8%ad-%d8%a3%d8%a8/,ريادة أعمال
التمويل الدولية و الصندوق الإجتماعي يستثمرون 75 مليون جنيه في Flat6Labs,"أعلنت اليوم فلات 6 لابز Flat6Labs الشركة و مسرعة الأعمال الرائدة في الاستثمارات فى الشركات الناشئة في منطقة الشرق الأوسط وشمال أفريقيا عن مشاركة مؤسسة التمويل الدولية (IFC) – وهي أحد أعضاء مجموعة البنك الدولي- من خلال برنامج “تحفيز الشركات الناشئة” وأيضاً الصندوق الإجتماعي للتنمية كمستثمرين رائدين في صندوق فلات6لابز الجديد في مصر للاستثمارات الأولية بقيمة 75 مليون جنيه مصري.شهد توقيع العقد وزير الصناعة و التجارة المهندس / طارق قابيل ، و الدكتور شهاب مرزبان نائباً عن وزيرة التعاون الدولي السيدة / سحر نصر ، و السيد فيليب لو هورو الرئيس التنفيذي لمؤسسة التمويل الدولية ، و الأمين العام للصندوق الإجتماعي للتنمية السيدة / نيفين جامع ، و السيد / هاني السنباطي رئيس مجلس إدارة  فلات6لابز Flat6Labs .ستقدم مؤسسة التمويل الدولية ما يصل إلى 2 مليون دولار أمريكي من تمويل لرأس المال إلى فلات6لابز القاهرة، والتي ستقوم بالاستثمار في حوالي 100 شركة تكنولوجية مصرية ناشئة وتدعم أكثر من 300 رائد أعمال على مدى السنوات الخمس المقبلة وهذا الاستثمار هو جزء من برنامج مؤسسة التمويل الدولية لتحفيز الشركات الناشئة، ويهدف إلى دعم الابتكار في مصر من خلال معالجة فجوات التمويل والمعرفة في المراحل المبكرة للشركات الناشئة. كما يمثل الصندوق الاجتماعي المصري للتنمية(SFD) كمستثمر رئيسي آخر في Flat6Labs.ستقدم Flat6Labs من خلال برنامجها لتسريع الاعمال, الذي مدته أربعة أشهر, التمويل, والإرشاد والتوجيه الإستراتيجي، وفرص التواصل، مما يساعد رواد الأعمال والشركات الناشئة على أن تصبح جاهزة للاستثمار.وقد صرح رامز الصيرفى، الرئيس التنفيذي لشركة فلات6لابز Flat6Labs :: نحن سعداء جدًا بتلقي الدعم من مؤسسة التمويل الدولية عبر برنامجها لتحفيز الشركات الناشئة، وكذلك الصندوق الاجتماعي للتنمية حيث يعتبر هذا أول استثمار من قبل الصندوق في مسرعات الأعمال لدعم الشركات الناشئة.” إن دعمهم وثقتهم في تاريخ فلات6لابز كبيرة وفي قدرتها على تنمية الشركات الناشئة في المراحل الأولي وهذه بمثابة شهادة لنموذج التمويل الخاص بنا والتزام من مؤسسة التمويل الدولية بتحفيز النمو الاقتصادي في مصر.”وقد صرح فيليب لو هورو، الرئيس التنفيذي لمؤسسة التمويل الدولية: “ إن مصر لديها امكانات هائلة للنمو، نظراً لموقعها الاستراتيجي في المنطقة، وتوافر القوى العاملة بأعداد كبيرة، كما أن بها قطاع صناعي قوي وراسخ” وأضاف: “إن الإصلاحات الاقتصادية التي أعلنتها الحكومة مؤخراً ستساعد على تحقيق هذه الإمكانات وبث روح جديدة في القطاع الخاص، وتشجيع الابتكار وخلق فرص العمل.”سيقوم الصندوق المخصص لمصر الذي تديره فلات6لابز بدعم ما يصل إلى 20 شركة ناشئة في السنة بمتوسط استثمار أولي يبلغ قرابة 350,000 جنيه مصري، لدعم قطاع الشركات الناشئة ودعم الابتكار وخلق فرص عمل.وقد صرحت نيفين جامع، الأمين العام للصندوق الاجتماعي للتنمية “إن إتاحة فرص عمل من المشاكل التي علينا معالجتها لتخفيف حدة الفقر وتحسين الظروف المعيشية للمواطن وخاصة الشباب كما أن دعم الشركات الصغيرة ومساعدتها على النمو ومشاركتها في رأس المال يتيح توفير فرص عمل ويعزز النمو الاقتصادي وهو ما دفع الصندوق الاجتماعي إلى وضع سياسة استثمارية بالتعاون مع خبراء البنك الدولي تستهدف الاستثمار في الشركات الناشئة ودعم رواد الأعمال والمشروعات ذات الأفكار الابتكارية.الصور خاصة ب فلات6لابز",https://preneur-masr.com/news/%d8%a7%d9%84%d8%aa%d9%85%d9%88%d9%8a%d9%84-%d8%a7%d9%84%d8%af%d9%88%d9%84%d9%8a%d8%a9-%d9%88-%d8%a7%d9%84%d8%b5%d9%86%d8%af%d9%88%d9%82-%d8%a7%d9%84%d8%a5%d8%ac%d8%aa%d9%85%d8%a7%d8%b9%d9%8a-%d9%8a/,ريادة أعمال
مؤسسة التمويل الدولية تستثمر 10 مليون $ في ألجيبرا فنشرز,وقعت في الخامسة و النصف من مساء اليوم الأربعاء 14 ديسمبر 2016 مؤسسة التمويل الدولية التابعة لصندوق النقد الدولي إتفاقية إستثمار بقيمة 10 مليون دولار أمريكي مع صندوق راس المال الجري / المخاطر ” ألجيبرا فنشرز Algebra Ventures ” في حضور وزيرة التعاون الدولي الدكتورة / سحر نصر ، و السيد / فيليب لو هورو نائب الرئيس التنفيذي و المسئول التنفيذي الأول لمؤسسة التمويل الدولية IFC  ، و السيد حسن الخطيب من بنك التنمية و الإعمار الأوروبي .و يهدف هذا التمويل إلي إتاحة التمويل للشركات الناشئة في قطاع تكنولوجيا المعلومات في مصر ، في إطار جهود مؤسسة التمويل الدولية لدعم ريادة الأعمال و تحفيز الإبتكار و توفير فرص العمل علي مستوي العالم بشكل عام و في مصر بشكل خاص.الجدير بالذكر أن هذا الإستثمار سيساعد Algebra Ventures في دعم 25 شركة ناشئة تعمل في قطاع تكنولوجيا المعلومات  ، و في مجالات مختلفة منه مثل التجارة الإليكترونية ، الخدمات المالية ، و خدمات الإنترنت.و صرح  السيد / فيليب لو هورو نائب الرئيس التنفيذي و المسئول التنفيذي الأول لمؤسسة التمويل الدولية IFC  :: إن الشركات الناشئة تعد مصدراً هائلاً لتوفير فرص العمل و تحفيز الإبتكار و لكنها تعاني من صعوبة في الحصول علي التمويل الذي تحتاجه لتحقيق التطور و النمو.و أضاف أنه يمكننا مساعدة هذه الشركات علي تحقيق النمو و خلق فرص العمل من خلال زيادة فرص الحصول علي التمويلو أن هذا الإستثمار من أجل إطلاق إمكانيات القطاع الخاص.كما قال السيد حسن الخطيب المدير التنفيذ بالبنك الأوروبي لإعادة الإعماربأنه يسر البنك الدخول في شراكة مع صندوق إلجيبرا فنشرز Algebra Ventures  و تعزيز إستثمارات رأس المال المخاطر في مصر إذ يعتمد الإقتصاد النشط و المستدام علي المشاريع المبتكرة و التي تتطلب بدورها التمويل في مراحلها الأولية .و رداً علي سؤال برينور – مصر له بإن كانت ألجيبرا فنشرز ستدخل مجالات جديدة أخري بخلاف تكنولوجيا المعلومات مع وجود مبلغ كبير مثل المبلغ الممول من مؤسسة التمويل الدولية ؟ أجاب الدكتور خالد إسماعيل بأن الصندوق سيستثمر في تكنولوجيا المعلومات بشكل عام حيث أنه سيتثمر في الشركات التي تركز علي التقنية و الشركات التي تستخدم تكنولوجيا المعلومات في تطوير أعمالها.تعليق برينور – مصر ::– ألف مبروك لمصر و المصريين هذه الخطوة لسببين هما ::1- أنها من ناحية تؤكد مدي ثقة المؤسسات المالية الكبري في الإقتصاد المصري .2- ثؤثر في ترتيب مصر في مجال ريادة الأعمال علي مستوي العالم.,https://preneur-masr.com/news/%d9%85%d8%a4%d8%b3%d8%b3%d8%a9-%d8%a7%d9%84%d8%aa%d9%85%d9%88%d9%8a%d9%84-%d8%a7%d9%84%d8%af%d9%88%d9%84%d9%8a%d8%a9-%d8%aa%d8%b3%d8%aa%d8%ab%d9%85%d8%b1-10-%d9%85%d9%84%d9%8a%d9%88%d9%86-%d9%81/,ريادة أعمال
مسابقة ” رالي ريادة الأعمال ” من الأكاديمية العربية,"تنظم الأكاديمية العربية للعلوم و التكنولوجيا و النقل البحري مسابقةفالأكاديمية رغم مشاركتها الدائمة في إقامة مسابقات و فعاليات ريادة الأعمال في مصر ، مثل الإسبوع العالمي لريادة الأعمال GEW إلا أنه لم تكن هناك مسابقة خاصة بها رغم إهتمامها منذ سنوات بمجال ريادة الأعمال ، و وجود مركز خاص بريادة الأعمال بالأكاديمية .مسابقة ريادة الأعمال ” Entrepreneurship Rally ” هدفها مساعدة أي شخص لديه فكرة مشروع و يريد تنفيذها. و تنقسم المسابقة إلي 4 فئات  هي ::1)  التأثير المجتمعي Social Impact :: 
و هي مخصصة للمشاريع ذات ” الخدمة المجتمعية “، و هي المشاريع التجارية التي تحقق ربح و في نفس الوقت تخدم المجتمع مثل تطبيق ” بيقولك ” الذي يساعد في حل مشكلة المرور .
2)  الإبداع الصناعي Industry Innovation :: و هو يستهدف الأفكار و المشروعات التي بها إبتكار صناعي 3- Export & Supply Chain :: للمشاريع اللي بتبتكر أفكار وطرق هدفها زيادة التصدير برة مصر.
4) المجال العام General Track :: هذه الفئة مخصصة لمن لا يندرج مشروعه تحت أياً من الفئات السابق ذكرها.
– شروط التقدم للمسابقة ::1- بالنسبة للفروع ( التأثير المجتمعي Social Impact – و – الإبداع الصناعي Industry Innovation – و – المجال العام General Track ) التقدم فيهما متاح للفرق و لكن لآبد أن يكون بالفريق 2 من طلبة أو خريجي الأكاديمية .2- مجال Export & Supply Chain متاح للجميع طالب بالأكاديمية أو غير طالب بالأكاديمية و لا يشترط أن يكون بالفريق طالب أو خريج للأكاديمية .للإنضمام للمسابقة من هنا :: https://goo.gl/forms/XM6dX06gEVtd9kB33أخر موعد لتلقي طلبات الإشتراك بالمسابقة 21 يناير 2017 .تعليق برينور – مصر ::1- وجود كيان مثل الأكاديمية العربية للعلوم و التكنولوجيا و النقل البحري ضمن قائمة الكيانات المنظمة لمسابقات في مجال ريادة الأعمال هي خطوة تصب بقوة في صالح هذا المجال و تسهم بقوة في زيادة تقييم ريادة الأعمال في مصر علي المستوي الدولي من قبل المنظمات الدولية و علي رأسها الأمم المتحدة. فالأكاديمية لاعب قوي في مضمار ريادة الأعمال.2- تخصيص فئة بالمسابقة للمشروعات أياً كان نوعها ” فئة المجال العام ” هو ضغط علي فريق عمل المسابقة إلا أنه خطوة تحسب بشدة لهذه المسابقة و هو تخصص سيميزها عن جميع مسابقات ريادة الأعمال في مصر و العالم العربي ، و تستحق الشكر علي تخصيصها لهذه الفئة في مسابقتها.تمنياتنا للأكاديمية العربية  للعلوم و التكنولوجيا و النقل البحري بالتوفيق و النجاح للمسابقة ( و هو ما نتوقعه لها بإذن الله )تمنياتنا للمشاركين في المسابقة بالتوفيق و النجاح في تنفيذ مشروعاتهم",https://preneur-masr.com/news/%d9%85%d8%b3%d8%a7%d8%a8%d9%82%d8%a9-%d8%b1%d8%a7%d9%84%d9%8a-%d8%b1%d9%8a%d8%a7%d8%af%d8%a9-%d8%a7%d9%84%d8%a3%d8%b9%d9%85%d8%a7%d9%84-%d9%85%d9%86-%d8%a7%d9%84%d8%a3%d9%83%d8%a7%d8%af%d9%8a/,ريادة أعمال
إنتهاء رايز اب 2016 Rise Up,إنتهي منذ ساعات قليلة للغاية أحد أهم الأحداث في مصر و الشرق الأوسط في مجال ريادة الأعمال و هو مؤتمر رايز اب Rise Up للعام 2016 . فبعد ثلاثة أيام من ورش العمل و المسابقات و جلسات التوجيه إنتهي رايز اب 2016 Rise Up .و الملاحظ في هذا العام هو كثرة عدد المشاركين و المهتمين  حيث أن هناك حضور ملحوظ لمصريين من محافظات مختلفة ، و كذلك الأجانب . كما كان هناك كم أكبر و أكثر للمشاريع العارضه بالمعرض . و يكفي ان نقول لزوارنا أنه من شدة المنافسة في جودة المشاريع العارضة لم يتسني لنا المشاركة في تقييم أي المشروع يستحق الفوز بجائزة الألف دولار أمريكي و المقدمة من رايز اب لأفضل مشروع فجميع الأفكار رائعة و تستحق جائزة. و قد فاز بجائزة أفضل مشروع في رايز اب لهذا العام مبادرة ” حلم ” .اللفتة التي تستحق التقدير و الإشادة هو أن أ / عبد الحميد شرارة أحد مؤسس رايز اب أستهل كلمته التي ألقاءها للحاضرين بإستنكار ما حدث من تفجيرات أول أمس الجمعة أمام مسجد السلام بالهرم ، وما حدث اليوم بالكاتدرائية بالعباسية و أكد للحاضرين أن ما يقومون به في رايز اب من حضور ورش عمل و ندوات هو ما سيقضي علي الأرهاب ، ثم طلب من الحاضرين الوقوف دقيقة كاملة حداداً علي أرواح الشهداء الذين سقطوا بالهرم و بالعباسية .بعد ذلك حيا مؤسسي رايز اب الشباب المشاركين في العمل ب رايز اب لهذا العام سواء موظفين أو متطوعين .ثم أعلن إنتهاء رايز لهذا العام. لمشاهدة صور رايز اب 2016 من خلال صفحتنا علي الفيس بوكتعليق برينور – مصر ::1- مؤتمر رايز اب Rise Up هو حدث هام في مصر و الشرق الأوسط و لكن الجميل في هذا المؤتمر هو الحالة التي أوجدها هذا المؤتمر فحب الحاضرين للحدث زاد من نجاح الحدث و هو شي يحسب لفريق عمل رايز اب ، و هذه الحالة بالتأكيد لم تأتي من فراغ و لكنها جاءت من ::أولاً ::  تنظيم جيد جداً جداً للمؤتمر.ثانياً :: جودة محتوي تم إختياره بعناية شديدة .2 – نجاح رايز لهذا العام و الأعوام السابقة بفضل الله يجعلني أتوقع أنه خلال ثلاث سنوات علي الأكثر سيكون هناك ::رايز اب دبيرايز اب أبوظبيرايز اب الرياضرايز اب البحرينرايز اب تونسرايز اب بيروترايز اب السودانو البقية ستأتي بإذن اللهشكراً رايز ابو إلي اللقاء أعزائنا زوار برينور – مصر في تغطية لرايز اب 2017,https://preneur-masr.com/news/%d8%a5%d9%86%d8%aa%d9%87%d8%a7%d8%a1-%d8%b1%d8%a7%d9%8a%d8%b2-%d8%a7%d8%a8-2016-rise/,ريادة أعمال
