Title,Content,Link,Category
الإمارات الخامسة عالمياً في ريادة الأعمال,صُنفَت دولة الإمارات في المركز الخامس على المستوى الدولي في مؤشر ريادة الأعمال لعام 2021 الذي أصدرته مجلة سي إي أو وورلد الأمريكية.ووفقاً لبيانات المؤشر، فقد استند إلى عدد من العوامل وهي: مستوى التنافسية الذي تتمتع به كل دولة في مجال ريادة الأعمال، والبنية التحتية المتوافرة، ومدى تشجيع كل دولة للابتكار في ريادة الأعمال، والمهارات التي تمتلكها القوة العاملة.واستندت أيضاً تصنيفات المؤشر إلى سهولة حصول رواد الأعمال على رؤوس الأموال، ومستوى انفتاح كل دولة على العمل التجاري.وحصلت الإمارات في مؤشر هذا العام على 31.01 درجة في الرصيد الإجمالي.وتصدرت دولة الإمارات العربية المتحدة المركز الأول عربياً في تقرير التنمية البشرية 2020 والصادر عن برنامج الأمم المتحدة الإنمائي.واحتلت الإمارات في وقت سابق المرتبة رقم 16 عالمياً محققة 75 نقطة في المعدل العام في تقرير “مخزون البيانات المفتوحة “ODIN” لعام 2020 الذي تصدره منظمة البيانات المفتوحة ويشمل 187 دولة حول العالم.وحققت الإمارات قفزة مقدارها 51 مرتبة دفعة واحدة بالمقارنة مع تقرير عام 2018 متقدمة على دول مثل الولايات المتحدة وكوريا وسويسرا وفرنسا وإسبانيا واليابان والمملكة المتحدة.المصدر :: مباشر – مصر ,https://preneur-masr.com/news/%d8%a7%d9%84%d8%a5%d9%85%d8%a7%d8%b1%d8%a7%d8%aa-%d8%a7%d9%84%d8%ae%d8%a7%d9%85%d8%b3%d8%a9-%d8%b9%d8%a7%d9%84%d9%85%d9%8a%d8%a7%d9%8b-%d9%81%d9%8a-%d8%b1%d9%8a%d8%a7%d8%af%d8%a9-%d8%a7%d9%84%d8%a3/,ريادة أعمال
باقي 4 أيام علي إنتهاء التقديم بمسابقة نواة 2020,مسابقة نواة أو جائزة الإبداع المصرية لريادة الأعمال ، هي مسابقة سنوية تدعم رواد الأعمال في مصر من خلال توفير فرصة للتحدى لرواد الأعمال للمنافسة على مستوى الجمهورية وعرض أفكارهم وشركاتهم الناشئة.المسابقة بتنظيم من  GEN Egypt بالتعاون مع برنامج دعم إصلاح التعليم الفني والتدريب المهني TVET Egypt ، الشريك المؤسس منظمة العمل الدولية ILO) ) والشريك التعليمي للمسابقة الأكاديمية العربية للعلوم و التكنولوجيا وبرعاية ” تطوير مصر ” شركة التطوير العقاري الرائدة بمصر وشركة جي ال سي للدهانات.السنة دى هي السنة السادسة لمسابقة نواة ، الهدف من تحدى نواة هو المساهمة في إزدهار وتنمية مجتمع ريادة الأعمال في مصر من خلال دعم رواد الأعمال المبتدئين وتطوير مهارتهم وقدراتهم وتوسيع شبكة علاقتهم ومصادرهم. يتم إختيار الأفكار والشركات الناشئة في مسابقة نواة بناءاً على عدة عوامل أهمها :: الإستدامة والأثر المجتمعي والإبتكار.يشارك المتأهلون للنهائيات في قمة مصر لريادة الأعمال واللي هتكون خلال شهر نوفمبر 2020 بأسوان ويحصل الفائزون، من الأقسام المختلفة، على جوائز مالية وتوجيه وتدريب للمساعدة في تطوير شركاتهم الناشئة وأفكارهميتم اختيار الأفكار بناءاً على ما يليالاستمرارية :: إزاى الفكرة/الشركة الناشئة تقدر تستمر على المدي الطويل – تحقق إستقرار مادياًالأثر المجتمعي :: إزاى الفكرة/الشركة الناشئة بتعمل على حل مشكلة إجتماعية أو ليها تأثير مجتمعيالإبتكار :: أن الفكرة/الشركة الناشئة تكون مبتكرةمراحل مسابقة نواة 2020مرحلة التقديميتم فتح باب التقديم لمسابقة نواة خلال شهر أكتوبر 2020، يتطلب من المتقدمين أنهم يقدموا فيديو لشرح الفكرة/الشركة الناشئة بالإضافة إلى الإجابة على أسئلة مختلفة لتوضيح خطة العمل الخاصة بالفكرة/الشركة الناشئة.مرحلة النصف نهائياتيتم تقييم الأفكار/الشركات الناشئة المتأهلة للنصف نهائيات من لجنة تحكيم مؤلفة من خبراء من مجالات مختلفة . كل فريق بيعرض الفكرة/الشركة الناشئة خلال 3 دقائق بحد أقصي وبعدها بيكون في 3 دقائق لإستقبال الاسئلة من لجنة التحكيم. بيتم تصفية الأفكار/الشركات الناشئة ل 15 فكرة/شركة ناشئة (5 من قسم الأفكار، 5 من قسم الشركات الناشئة و5 من قسم المدارس) للوصول للنهائيات.مرحلة التدريب والنهائياتتشارك الأفكار/الشركات الناشئة المتأهلة للنهائيات في برنامج تدريبي مدته 5 أيام لقسم الشركات الناشئة و قسم الأفكار والمدارس. يتم دعوة الفرق المتأهلة لحضور قمة مصر لريادة الأعمال في أسوان من 19 حتي 21 نوفمبر لمقابلة رجال أعمال، مستثمرين ومؤسسات داعمة لريادة الأعمال. بعد فترة التدريب، يقوم المتأهلين بعرض أفكارهم/شركاتهم الناشئة خلال يوم النهائيات وهو اليوم الأخير لقمة مصر لريادة الأعمال. يحصل الفائزون على برامج متابعة بعد مرحلة المسابقة الي جانب جوائز مالية وفرص متنوعة من شركاء المسابقة.آخر موعد للتقديم بمسابقة نواة هو الخميس 5 نوفمبر 2020 رابط التقديم هنــــــــــــــامع اطيب التمنيات للجميع بالتوفيق,https://preneur-masr.com/news/%d8%a8%d8%a7%d9%82%d9%8a-4-%d8%a3%d9%8a%d8%a7%d9%85-%d8%b9%d9%84%d9%8a-%d8%a5%d9%86%d8%aa%d9%87%d8%a7%d8%a1-%d8%a7%d9%84%d8%aa%d9%82%d8%af%d9%8a%d9%85-%d8%a8%d9%85%d8%b3%d8%a7%d8%a8%d9%82%d8%a9-%d9%86/,ريادة أعمال
ICSB :: مستقبل ريادة الأعمال و MSME’s – مرحلة ما بعد الكورونا,يعقد الليلة الخميس 14 مايو 2020 في الساعه العاشرة مساء أول جلسة للمجلس الدولي للمشروعات الصغيرة (ICSB) باللغة العربية تحت عنوانمستقبل ريادة الأعمال و المشروعات الصغيرة و المتوسطة و متناهية الصغر – مرحلة ما بعد كوروناو ذلك في الساعة 4 مساء بتوقيت الساحل الشرقي للولايات المتحدة الأمريكية و الساعة 10 مساءً بتوقيت القاهرة!يشارك في الجلسة معالي الوزيرة الدكتورة / هالة السعيد ، وزيرة التخطيط والتنمية الإقتصادية إلي جانب مجموعة متميزة من الخبراء والمتحدثين وهم:د/ أحمد شلبي ، الرئيس التنفيذى والعضو المنتدب ، شركة تطوير مصرأ / أمل دخان ، الرئيس التنفيذي، الشبكة العالمية لريادة الأعمال بالسعوديةأ / حسين المحمودي ، الرئيس التنفيذي ، مجمع الشارقة للأبحاث والتكنولوجيا والابتكار (SRTI) الإمارات د/ سمر باقر ، أستاذه بكلية إدارة الأعمال ، جامعة الكويتالسيد / أش روفايل ، مؤسس وشريك، فيف كابيتال ، الولايات المتحدة الأمريكيةأ / سناء أبو زيد ، مدير بمؤسسة التمويل الدولية IFC ، مجموعة البنك الدوليويدير الجلسة المهندس / أحمد عثمان ، رئيس المجلس الدولي للمشروعات الصغيرة (ICSB).تأتي أهمية هذه الجلسة أنها أول جلسة باللغة العربية ينظمها أكبر كيان خاص بالمشروعات الصغيرة في العالم و هو المجلس الدولي للمشروعات المتوسطة و الصغيرة ICSB ، و بناقش في هذه الجلسة الظروف و المستجدات التي طرأت علي العالم بصفة عامة و العالم العربي بصفة خاصة بعد جائحة كورونا ، و كيف سيكون شكل مجتمع ريادة الأعمال و المشروعات الصغيرة بعد هذه الجائحة .لتسجيل الحضور بالجلسة : https://bit.ly/3ckGF6G,https://preneur-masr.com/news/icsb-%d9%85%d8%b3%d8%aa%d9%82%d8%a8%d9%84-%d8%b1%d9%8a%d8%a7%d8%af%d8%a9-%d8%a7%d9%84%d8%a3%d8%b9%d9%85%d8%a7%d9%84-%d9%88-msmes-%d9%85%d8%b1%d8%ad%d9%84%d8%a9-%d9%85%d8%a7-%d8%a8%d8%b9%d8%af/,ريادة أعمال
مسابقة تطوير مصر 2020 لريادة الأعمال,"للعام الرابع علي التوالي تنظم شركة تطوير مصر مسابقتها لرواد / لرائدات الأعمال و المبدعين و المبتكرين و المخترعين ، فإذا كنت / كنتي أحد هولاء فمسابقة تطوير مصر هي المسابقة التي تستطيعون من خلالها تطبيق و تنفيذ إبداعكم .و تنظم شركة تطوير مصر مسابقة هذا العام من خلال فرعين بالمسابقة و هما ::الفرع الأول :: مسابقة الشركات القائمه :: سواءً كانت شركة ناشئة / شركة متناهية الصغر / شركة صغيرة / شركة متوسطة .الفرع الثاني :: مسابقة الأفكار :: سواءً كان صاحب الفكرة مبتكر / مخترع / طالب / خريج حديث و حتي صغار رواد الأعمال .معايير إختيار الشركات / الأفكار ::1- تلبية إحتياجات قطاع التطوير العقاري .2- الإبداع و الإبتكار .مجالات المسابقة ::1- تكنولوجيا البناء .2- إدارة المخلفات و الحلول البيئية .3- الحلول التكنولوجية و الرقمية .4- الصناعات الإبداعية و التكنولوجية .5- حلول النقل و البنية الأساسية .6- نظم إدارة المياه .7- العمارة الذكية و العمارة الخضراء .8- الرعاية الصحية .9- تمكين ذوي القدرات الخاصة / ذوي الهمم .10- تكنولوجيا إدارة التجمعات .الجوائز ::1- جوائز مالية كما يلي ::فرع الشركات القائمة :: جائزة قدرها 250000 جنيه مصري للمركز الأول .فرع الأفكار :: جائزة قدرها 100000 جنيه مصري للمركز الأول .2- توجيه و إرشاد لمدة سنة واحدة مقدمة من شركة رأس المال الجري / المخاطر  Vive Capital .3- توجيه و إرشاد لمدة سنة واحدة مقدم من مؤسسة GEN Egypt التابعة لشبكة ريادة الأعمال العالمية GEN .الموعد النهائي للتقديم في المسابقة 10 مارس 2020رابط التقديم هنـــــــــــــــــــــــامع اطيب تمنيات برينور مصر للجميع بالتوفيق
",https://preneur-masr.com/news/%d9%85%d8%b3%d8%a7%d8%a8%d9%82%d8%a9-%d8%aa%d8%b7%d9%88%d9%8a%d8%b1-%d9%85%d8%b5%d8%b1-2020-%d9%84%d8%b1%d9%8a%d8%a7%d8%af%d8%a9-%d8%a7%d9%84%d8%a3%d8%b9%d9%85%d8%a7%d9%84/,ريادة أعمال
MAGNiTT :: إستثمارت قياسية للشركات الناشئة في 2019  و مصر تتصدر,نشرت شركة “ماجنيت MAGNiTT  ” لبيانات الشركات الناشئة التقرير السنوي لاستثمارات رأس مال المخاطر، والذي يقدم تحليل عميق عن الشركات الناشئة والاستثمارات عبر منطقة الشرق الأوسط و شمال أفريقيا “مينا” في 2019.وجدت الشركة أن عام 2019 يشكل عاما قياسيا لمؤشرات رئيسية بما في ذلك عدد الاستثمارات وعدد التخارجات وإجمالي عدد المستثمرين الذين يستثمرون في الشركات الناشئة الواقعة في المنطقة.وقال فيليب باشوشي، مؤسس “ماجنيت” ومديرها التنفيذي، إن هذه المؤشرات القياسية تشير إلى نضج النظام البيئي لهذه الشركات، مضيفا أن ارتفاع التخارجات إلى أعلى مستوى على الإطلاق، بما في ذلك تخارج أول شركة يونيكورن (أي تتجاوز قيمتها مليار دولار)، يعني أن مؤسسي الشركات والمستثمرين والحكومات يشهدون مردود مجهوداتهم في مجال الاستثمار في التكنولوجيا.704 مليون دولار تمويلات في 2019وارتفع عدد الاستثمارات في الشركات الناشئة الواقعة في المنطقة بنسبة 31% مقارنة بعام 2018 إلى 564 استثمار، وهو ما يظهر استمرار الإقبال على شركات المنطقة، وبلغت قيمة التمويلات الإجمالية 704 مليون دولار، أي أعلى بنسبة 13% عن 2018، باستثناء الصفقات الضخمة السابقة في شركات سوق وكريم.وشهدت مصر أعلى رقم من الصفقات، أما الإمارات فحصلت على حصة الأسد من التمويلات، وبالنظر إلى الحجم الكبير للسوق المصري، فقد ارتفع عدد الصفقات به ارتفاعا مطردا على مدار السنوات الماضية، وتجاوز الآخرون في 2019، مستحوذا على 25% من إجمالي الصفقات.وحافظت الإمارات على هيمنتها التاريخية باعتبارها المستقبل الأكبر للتمويلات، وحصلت على 60% من إجمالي التمويل بفضل استمرار الدعم من الحكومة وازدياد اهتمام المستثمرين بالشركات الناشئة الواقعة في الدولة.ومع ذلك، بدأ المشهد يتطور مع ظهور النظم البيئية في دول أخرى مثل السعودية التي شهدت النظام الأسرع نموا عبر المنطقة، وتحتل المركز الثالث فيما يتعلق بعدد الصفقات وإجمالي التمويل.27 صفقة تخارجوارتفع عدد التخارجات عبر المنطقة إلى 27 تخارج، وتبدو العديد من الصناعات في المنطقة، بما في ذلك التجارة الإلكترونية والمواصلات، مقسمة بشدة، ويتطلع المستثمرون والشركات الناشئة إلى الاندماج.ومع استحواذ “أوبر” على كريم بقيمة 3.1 مليار دولار، أصبحت كريم أول شركة يونيكورن تتخارج في المنطقة،ووصل عدد المؤسسات التي استثمرت في الشركات الناشئة في المنطقة إلى 212 مؤسسة بارتفاع بنسبة 39% عن 2018، وارتفع متوسط حجم الصفقات بنسبة7% عبر جميع الصفقات في 2019، وشهد العام كذلك تنوعا في المستثمرين مثل الشركات ومكاتب الأسر وشركات الاستثمار المباشر ومديري الأصول.كما ازدادت مشاركة المستثمرين الدوليين، وكان 25% من كل الكيانات التي استثمرت في شركات المنطقة مستثمرين من خارج المنطقة وهو ما يشكل مستوى قياسي جديد.برامج حكومية للدعم الفني والماليوقال علي أبوكميل ، متخصص في القطاع الخاص في البنك الدولي، إن العديد من الحكومات في المنطقة لعبت دورا نشطا في توفير النظم البيئية لرواد الاعمال بما في ذلك برامج الدعم الفني والمالي، والإصلاحات السياسية، وأوضح أن هناك علاقة مباشرة بين البيئة الصديقة للأعمال وازدياد نشاط ريادة الاعمال.وأوضح تقرير “ماجنيت” أن مجال التكنولوجيا المالية لا يزال القطاع الأكثر نشاطا فيما يتعلق بعدد الصفقات، وبعدما استحوذ قطاع التجارة الإلكترونية على الاهتمام في 2018، عادت التكنولوجيا المالية لتصدر المشهد في 2019، وشكلت 13% من جميع الصفقات، بينما حصل قطاع التوصيل والنقل على الحصة الأكبر من التمويل عند 19%، نتيجة لجمع شركات النقل بالاتوبيسات مثل “سويفل” والشاحنات مثل “تراكر” مبالغ هائلة عبر جولات التمويل عند 42 مليون دولار 23 مليون دولار على التوالي.المصدر ::  economyplus + الصورة MAGiTT,https://preneur-masr.com/news/magnitt-%d8%a5%d8%b3%d8%aa%d8%ab%d9%85%d8%a7%d8%b1%d8%aa-%d9%82%d9%8a%d8%a7%d8%b3%d9%8a%d8%a9-%d9%84%d9%84%d8%b4%d8%b1%d9%83%d8%a7%d8%aa-%d8%a7%d9%84%d9%86%d8%a7%d8%b4%d8%a6%d8%a9-%d9%81%d9%8a-2019/,ريادة أعمال
