Title,Content,Link,Category
سحبت أموالي من البنوك.. تعرف على أبرز أراء الملياردير المصري محمد منصور حول الاستثمار,"لم يكن محمد منصور، الملياردير ورجل الأعمال المصري، راضيًا عن عوائد استثماره في البنوك، لذلك لم يشعر منصور بالندم أبدًا على سحب أمواله منها، واستثمارها بنفسه بعد ذلك.



قال محمد منصور في حواره مع وكالة بلومبرج الأمريكية، “عندما تذهب لاستثمار أموالك في البنوك يستقبلك في البداية فريق رائع، لكنك لا تعرف في الحقيقة من يدير أموالك، وفي النهاية تحصل على عائد سنوي 2%”.



يشرف الملياردير المصري البالغ من العمر 72، على ثروة عائلته المالكة لمجموعة منصور من خلال شركة استثمارية، وتمتلك المجموعة عدد من التوكيلات تشمل جنرال موتورز، ومطاعم ماكدونالدز، ومتاجر مترو وغبرها، بحسب وكالة بلومبرج.



وتقدر قيمة مجموعة منصور الآن بحوالي 7 مليار دولار، وابنه لطفي هو الرئيس التنفيذي لمكتب العائلة في لندن، والتي لها أيضا شركة رأس مال مغامر في سان فرانسيسكو.  



وذكر منصور خلال حواره مع بلومبرج، كيف أنه خفض تعرضه للخسارة خلال تداعيات فيروس كورونا، إذ قال” كان وقتها الفيروس ينتشر في الصين، ثم بدأ يضرب أوروبا، ذهبت إلى مكتبي وأخبرت فريقي، أننا بحاجة إلى الخروج من أي أسهم ليست في قطاع التكنولوجيا، ودخلنا في ذلك المجال منذ ذلك الحين”



بعد خدمته في الحكومة من عام 2005 حتى 2009، قرر بدأ حياة مهنية جديدة، كانت وقتها شركات مجموعة منصور قوية، لذا أراد إدارة واستثمار أمواله الخاصة.



وقال منصور لبلومبرج “كنا نعطيهم لأحد البنوك لاستثمارهم، لكن الأمر لا يتطلب الدراية بعلم الصواريخ، يمكننا توظيف شباب وشابات أذكياء لإدارة أموالنا، فإذا كان البنك يستطيع فعل ذلك، لماذا لا نفعلها بأنفسنا؟”.



وأضاف منصور “لدبنا الآن فريق مكون من 14 شخصًا، بما فيهم ابني وتعرض علينا عدد كبير من الصفقات، كان بالتأكيد القرار الصحيح”.



بلغت قيمة ثروة منصور في بداية عام العام الحالي 3.3 مليار دولار، وهو ثاني أغني رجل أعمال مصري، وفقا لتقديرات فوربس.



ويتذكر منصور منذ حوالي 15 عاما في إحدى المؤتمرات، عندما سمع رجلًا يقول إن العالم سيتغير يوما ما، وإننا لن نكون في حاجة للذهاب إلى الطبيب، فقط سنحتاج إل شاشة ليشخص الطبيب مرضك ويعطيك الدواء، قلت وقتها” إن قطاع التكنولوجيا هو المستقبل، لذلك استثمرنا مبكرا في فيسبوك وتوتير وأوبر وسبوتيفاي ومؤخرا في Snowflake و Adyen.
اذا كنت ترى شيءً غير صحيح او ترغب بالمساهمه في هذا الموضوع، قم بمراجعه قسم السياسة التحريرية.",https://waya.media/arabi/%d8%b3%d8%ad%d8%a8%d8%aa-%d8%a3%d9%85%d9%88%d8%a7%d9%84%d9%8a-%d9%85%d9%86-%d8%a7%d9%84%d8%a8%d9%86%d9%88%d9%83-%d8%aa%d8%b9%d8%b1%d9%81-%d8%b9%d9%84%d9%89-%d8%a3%d8%a8%d8%b1%d8%b2-%d8%a3%d8%b1/,تقارير
كيف أثر فيروس كورونا على الاقتصاد المصري؟,"أصدر الجهاز المركزي للتعبئة العامة والإحصاء، دراسة حول تداعيات فيروس كورونا المستجد على الاقتصاد المصري من خلال تتبع التغيرات في بعض المؤشرات الاقتصادية الكلية الأساسية خلال فترة ذروة الوباء، والتي تشمل معدل النمو الاقتصادي، والبطالة، والتضخم، وأسعار الصرف والفائدة على الجنيه المصري، وكذلك على التجارة الخارجية بما فيها الواردات والصادرات السلعية غير البترولية.



ومن بيانات الآثار الجائحة على مستوى القطاعات الاقتصادية الرئيسية من خلال تعقب حركة مؤشرات الإنتاج الكلي والرقم القياسي للصناعات التحويلية والاستخراجية ومؤشر مديري المشتريات، فضلا عن تتبع التغيرات في مستوى النشاط الاقتصادي لخمسة قطاعات إنتاجية رئيسية وهي: الأسمنت، وحديد التسليح، والسكك الحديدية، وقناة السويس، والسياحة، وكذلك صافي الإحتياطات كمؤشر من المؤشرات الاقتصادية الكلية، وأخيرا التأثير على أداء البورصة.



هذا ويشير البيان إلى التطورات الحالية التي شهدتها أهم تلك المؤشرات عقب انحسار ذروة المرض، وذلك وفقا لأحدث بيانات رسمية متاحة.



هذا وقد شهدت الفترة من بداية الجائحة وحتى الأسبوع الثالث تقريبا من شهر يونيو 2020 نموا في معدل حدوث الإصابات المؤكدة.  



في حين شهد الأسبوع الأخير من يونيو 2020 انتهاء مرحلة التوسع الوبائي وبداية انحسار الأزمة مع اتجاه معدل حدوث الإصابات المؤكدة نحو الانخفاض، وقد بلغ تقدير معدل النمو اليومي للإصابات المؤكدة بكوفيد-19، قبل ذروة الجائحة نحو 5.3% يوما، وفترة المضاعفة قبل الذروة بلغت 13.2 يوما، وبعد تجاوز الذروة حتى الآن نحو -3.0%، كما بلغ تقدير فترة النصف – والتي تقيس عدد الأيام التي ينخفض فيها المعدل التراكمي للإصابات المؤكدة بالفيروس بمقدار النصف – حوالي 22.9 يوماً.



تناولت الدراسة أثر فيروس كورونا على:



1. الناتج المحلي الإجمالي
انخفض معدل النمو السنوي للناتج المحلي الإجمالي الحقيقي في الربع الثالث من 2019/2020 بمقدار 0.6 نقطة مئوية عن مثيله عام 2018/2019، حيث سجل 5% في 2019/2020 مقابل 5.6% عام 2018/2019.



2. الرقم القياسي لأسعار المنتجين والمستهلكين
شهد معدل تغير أسعار المنتجين تدهورا مستمرا خلال الفترة فبراير-أبريل 2020 مسجلا معدل تراجع سنوي بلغ 18.8 % في نهاية الفترة. ويُعزى هذا التراجع إلى انخفاض أسعار أنشطة الزراعة وصيد الأسماك والتعدين واستغلال المحاجر وخدمات الغذاء والإقامة بنسب 4.5 % و67.7 % و8.1 %، على التوالي.



ويلاحظ أن تأثير كوفيد-19 على معدل التضخم السنوي لأسعار المستهلكين محدود إذا ما قورن بأثر الجائحة على معدل التغير السنوي لأسعار المنتجين.



3. أسعار الصرف
شهد الجنيه المصري انخفاضاً خلال الفترة من فبراير حتى مايو 2020 بلغ نحو 1.8% من قيمته، وذلك تزامنا مع تراجع التدفقات الدولارية نتيجة لعدة أسباب منها على سبيل المثال انخفاض الصادرات السلعية بمعدل 39.4 % في نفس الفترة، وقد تفاقم الأثر السلبي على قيمة الجنيه جراء تأثر قطاع السياحة بشكل ملحوظ بانتشار الفيروس والانخفاض الكبير في أعداد السائحين والليالي السياحية مع إغلاق المطارات وتعليق الرحلات الجوية…الخ، مما ساهم في تراجع إيرادات مصر من النقد الأجنبي.



4. قناة السويس
انخفضت إيرادات قناة السويس بالدولار الأمريكي إبتداءً من أبريل 2020 مقارنة بالمستويات المناظرة في العامين السابقين 2018 و2019 نظراً لتأثر التجارة العالمية بشكل عام بالجائحة. بينما سجل معدل التغير الشهري للإيرادات أدنى مستوي (-7.5%) في شهر مايو 2020 مقارنة بنفس الشهر في العامين السابقين (4.5% و 6.0% على التوالي).



ويمكن تحديد التأثير الحقيقي للجائحة على قطاع قناة السويس بالنظر للتغير في الحمولات الصافية وعدد السفن العابرة للقناة قبل وبعد فبراير 2020، حيث انخفضت الحمولات من 101.8 مليون طن إلى 84.2 مليون طن، وانخفضت أعداد السفن من 1731 إلى 1381 سفينة خلال الفترة أبريل-يونيو 2020.



5. قطاع السياحة والسكك الحديدية
لحق ضرر جسيم بقطاع السياحة من حيث أعداد السائحين حيث انخفضت من 0.9 مليون سائح في فبراير 2020 إلى 0.0 مليون سائح في إبريل 2020 بنسبة انخفاض 100%، أما قطاع السكك الحديدية فقد إنخفضت الإيرادات الحقيقية للسكك الحديدية بنسبة 55.7% خلال الفترة من فبراير-أبريل 2020.



6. صافي الاحتياطي
انخفض صافي الاحتياطات الدولية بقيمة 9.5 مليار دولار خلال الفترة من فبراير–مايو 2020.



تراجع صافي الاحتياطيات الدولية الشهري مع تفشي الجائحة في مصر، حيث بلغت معدلات الانخفاض الشهرية حوالي 11.9%، 7.7% في مارس وأبريل 2020، قبل أن ينخفض ذلك المعدل إلى 2.8% في مايو 2020.



7. التجارة الخارجية
شهد معدل التغير السنوي للواردات السلعية غير البترولية (بالدولار الأمريكي) أقصى انخفاض له منذ يناير 2019 في أشهر فبراير وأبريل ومايو 2020 بمعدلات تصل إلى 25.5% و35.0% و35.8% على التوالي.



بينما تراجع معدل التغير السنوي للصادرات السلعية غير البترولية (بالدولار الأمريكي) بمعدل 19.9% و36.0% في أبريل ومايو 2020 على التوالي.



8. البورصة المصرية
انخفض مؤشر البورصة المصرية انخفاضاً حاداً في أعقاب الجائحة خاصة في شهري مارس ومايو حيث أغلق عند 9593.9 و10220.1 نقطة على التوالي، مسجلاً أعلى معدل تراجع شهري منذ يناير 2019.



ومن الجدير بالذكر عدم تأثير الجائحة على قيمة وحجم التداول وحجم العمليات في البورصة المصرية حتى شهر أبريل 2020، والذي شهد تحسناً ملحوظاً في أداء البورصة مقارنة بالشهر المناظر في عام 2019 نتيجة للحزم التحفيزية التي قدمتها الحكومة.



وفي سياق متصل يلاحظ أن العديد من المؤشرات التي شهدت تراجعاً خلال فترة الذروة، قد شهدت بعض التغيرات في ظل انحسار الأزمة في مصر، حيث تراجع الانخفاض في معدل التغير السنوي لأسعار المنتجين ليسجل -15.2% -ارتفاعا بمقدار 3.6 نقطة مئوية- في شهر مايو 2020.
اذا كنت ترى شيءً غير صحيح او ترغب بالمساهمه في هذا الموضوع، قم بمراجعه قسم السياسة التحريرية.",https://waya.media/arabi/%d9%83%d9%8a%d9%81-%d8%a3%d8%ab%d8%b1-%d9%81%d9%8a%d8%b1%d9%88%d8%b3-%d9%83%d9%88%d8%b1%d9%88%d9%86%d8%a7-%d8%b9%d9%84%d9%89-%d8%a7%d9%84%d8%a7%d9%82%d8%aa%d8%b5%d8%a7%d8%af-%d8%a7%d9%84%d9%85%d8%b5/,تقارير
ILLA تحصد تمويلا تأسيسيا بقيمة ٥٠٠ ألف دولار,"حصدت منصة الخدمات اللوجستية والتوصيل المصرية ILLA،  تمويلا تأسيسيا بقيمة ٥٠٠ ألف دولار، بقيادة Averroes VC و AUC Angels، ومشاركة Flat6Labs Cairo وعدد من المستثمرين الملائكيين.



انطلقت ILLA في مارس ٢٠١٩ على يد محمود الزمر، وعلاء جركس، وأحمد صقر، وحسام سرايا، وذلك من خلال احتضانها في مسرعة الأعمال Flat6Labs وبدء العمل في المرحلة التجريبية على مدار ٨ أشهر، لتبدأ بعدها مرحلة جديدة في تقديم خدماتها.



تقدم المنصة خدمات التوصيل والخدمات اللوجستية في الميل الأخير، من خلال ربط الشركات الموزعة للمنتجات المختلفة مع الشاحنات حسب الطلب. وتعمل الآن في أكثر من ٢٤ محافظة مصرية ساهمت عبرها من إتمام نحو ٧ ملايين عملية توصيل.



تهدف ILLA استخدام التمويل الجديد في تعزيز قدراتها وقيادة قطاع خدمات التوصيل والخدمات اللوجستية في الميل الأخير في مصر.  
اذا كنت ترى شيءً غير صحيح او ترغب بالمساهمه في هذا الموضوع، قم بمراجعه قسم السياسة التحريرية.",https://waya.media/arabi/illa-%d8%aa%d8%ad%d8%b5%d8%af-%d8%aa%d9%85%d9%88%d9%8a%d9%84%d8%a7-%d8%aa%d8%a3%d8%b3%d9%8a%d8%b3%d9%8a%d8%a7-%d8%a8%d9%82%d9%8a%d9%85%d8%a9-%d9%a5%d9%a0%d9%a0-%d8%a3%d9%84%d9%81-%d8%af%d9%88%d9%84/,شركات ناشئة
واتساب تتعاقد مع الشركة المصرية “سيكونس” كموفرة لحلول “واتساب بزنس”,"أعلنت شركة سيكونس المصرية عن توقيع صفقة مع شركة واتساب لتصبح مزودة حلول لخدمة واتساب بزنس، لتمكين الشركات الصغيرة والمتوسطة الحجم والكبيرة في العالم، الاستفادة من هذه الخدمة لعرض منتجاتها وخدماتها الأخرى، فضلا عن التواصل مع عملائها.



لدى واتساب أكثر من ٢ مليار مستخدم نشط في ١٨٠ دولة. وينظر لواتساب بزنس كأداة جذابة تضمن تجربة قيمة للتواصل مع العملاء. بالنسبة للشركات الصغيرة، تعتبر واتساب مساعد اتصالات رقمي مباشر، أما بالنسبة للشركات المتوسطة والكبيرة، فإنها تدعم اتصالات المؤسسات على نطاق عالمي لتوفير دعم العملاء وتقديم الإخطارات المهمة.



تقدم سيكونس حلول واتساب بزنس كجزء من منصة الاتصالات الخاصة بها، حيث تجمع بين العديد من حلول التواصل وواجهات برمجة التطبيقات التي تساعد الشركات على تبني تقنيات فعالة لتعزيز اتصالاتها.



 أطلقت سيكونس أيضا أحدث منتجاتها الرقمية CEQUENS Chat، وهي واجهة ويب تكميلية تسمح للعلامات التجارية بالتفاعل مع العملاء على منصة الرسائل التي يفضلونها، بما في ذلك واتساب بزنس وفيسبوك ماسينجر وآبل تشات وغوغل تشات وأس أم أس وغيرها، كما تجمع منصات المحادثة المتعددة في واجهة واحدة، لتحقيق أقصى قدر من الكفاءة. ويعمل هذا على دمج نهج القنوات المتعددة الكامل لشركة سيكونس تجاه التحول الرقمي، ويدمج عمليات دعم العملاء في منصة واحدة متكاملة.   



 قال كريم خورشيد، المؤسس والرئيس التنفيذي لشركة سيكونس في بيان صحفي: “نحن دائما نتبنى أعلى المعايير ونستخدم أحدث التقنيات عندما يتعلق الأمر بالاتصالات. أن تصبح شركتنا موفرا عالميا لحلول واتساب بزنس هى خطوة مهمة إلى الأمام لعملائنا. لدينا الآن الأدوات اللازمة لزيادة الترويج ونشر نظام أساسي شامل يلبي احتياجات كل قطاع أعمال بالطريقة الأكثر ملائمة”.



ومن جانبه أكد وائل علي، الرئيس التنفيذي للشؤون التجارية في سيكونس على أهمية الخدمة، قائلا: “تعتبر صناعة الاتصالات متبنية مهمة لجميع الحلول الرقمية بما في ذلك واتساب بزنس. نحن نسعى لتقديم الخدمة لعدة قطاعات بما في ذلك قطاع البيع بالتجزئة والتجارة الإلكترونية والخدمات المصرفية والخدمات اللوجستية والسفر. ومع CEQUENS Chat تعتبر واتساب بزنس أداة إنتاجية مجربة ومختبرة”.



يمكن الآن للشركات في مختلف الصناعات التواصل مع سيكونس، وطلب عرض توضيحي مجاني لتجربة التشغيل العملي لحلول واتساب بزنس.
اذا كنت ترى شيءً غير صحيح او ترغب بالمساهمه في هذا الموضوع، قم بمراجعه قسم السياسة التحريرية.",https://waya.media/arabi/%d9%88%d8%a7%d8%aa%d8%b3%d8%a7%d8%a8-%d8%aa%d8%aa%d8%b9%d8%a7%d9%82%d8%af-%d9%85%d8%b9-%d8%a7%d9%84%d8%b4%d8%b1%d9%83%d8%a9-%d8%a7%d9%84%d9%85%d8%b5%d8%b1%d9%8a%d8%a9-%d8%b3%d9%8a%d9%83%d9%88%d9%86/,شركات ناشئة
من هو حسين سجواني؟,"أعلن الملياردير الإماراتي حسين سجواني عن تطلعاته للاستثمار خارج الخليج، وتوسعه في أوروبا وأمريكا، وذلك بعد استثماره في عدة شركات في السعودية ولبنان وكندا.



حسين سجواني رجل أعمال ومؤسس ورئيس مجلس إدارة داماك العقارية، شركة التطوير العقاري العالمية، ومؤسس ورئيس مجلس إدارة مجموعة شركات دايكو. كما أنه صديق للرئيس الأمريكي دونالد ترامب.



تخرج سجواني في جامعة واشنطن، وبدأ مسيرته المهنية كمدير للعقود في شركة أبوظبي لصناعات الغاز المحدودة (جاسكو) التابعة لشركة بترول أبوظبي الوطنية (أدنوك). وبعد فترة وجيزة، قام بتأسيس عمله التجاري الخاص. وفي عام ١٩٨٢ أسس مشروعه المتخصص في مجال التموين.



كان سجواني أحد رواد توسع السوق العقارية في دبي. وفي منتصف تسعينيات القرن الماضي، قام ببناء العديد من الفنادق بغية استيعاب التدفق المتزايد للأشخاص القادمين إلى الإمارة بغرض مزاولة الأعمال والأنشطة التجارية. وفي عام ٢٠٠٢، أسس شركة داماك العقارية، والتي سجلت نموا باهارا لتصبح واحدة من أكبر شركات التطوير العقاري في المنطقة، وتمتلك اليوم العديد من المشاريع المرموقة في مدن عالمية كبيرة مثل دبي، أبوظبي، الدوحة، عمان، بيروت، جدة، الرياض، ولندن.  



تضم شركة داماك العقارية ما يقارب ١٤٠٠ موظف، وهي شركة مساهمة عامة مدرجة في بورصة الأوراق المالية، ولها أسهم متداولة في سوق دبي المالي. تمتلك الشركة أفضل السجلات في سوق تطوير العقارات الفاخرة، وقد أتمت حتى اليوم تسليم ما يزيد على ٣٠ ألف منزل وبلغ عدد وحداتها السكنية ما يزيد عن ٣٤ ألف وحدة في مراحل متفاوتة من التخطيط والإنشاء. بصفتها علامة تجارية رائدة، ضمت داماك العقارية قواها مع بعض أشهر العلامات التجارية للأزياء لتقديم مفاهيم جديدة وعصرية للمعيشة. تشمل المشاريع ملعبًا للغولف من تصميم تايجر وودز، والذي تديره منظمة ترامب، ومنازل فاخرة ذات تصميمات داخلية من قبل علامات الموضة الإيطالية الرائدة مثل فيرساتشي هوم وجست كافالي فضلا عن عقارات ذات مميزات فريدة من نوعها مع فنادق ومنتجعات باراماونت، مجموعة فنادق راديسون ، وروتانا.



كرجل أعمال ومستثمر ذكي، يتمتع سجواني أيضا بسجل حافل من النجاحات في أسواق الأسهم والأوراق المالية العالمية. أسس سجواني مجموعة “دايكو” في أوائل التسعينيات كأداة استثمار تابعة له. تدار المجموعة من خلال خبرة الفريق الواسعة في الاستثمارات والخدمات المالية، وتركز على بناء محفظة متنوعة من الأعمال الجديدة عبر المناطق الجغرافية والصناعات مثل الأزياء الفاخرة والعقارات والضيافة والتصنيع وغيرها. واليوم، تمتد بصمة “دايكو” العالمية إلى أمريكا الشمالية وأوروبا وآسيا والشرق الأوسط وإفريقيا.



يمتلك سجواني حاليا محافظ استثمارية للأوراق المالية في عدد من الأسواق الإقليمية والعالمية من خلال “دايكو” للاستثمار (ذ.م.م.). تركز هذه الشركة على الاستثمارات في الأسهم الخاصة وعمليات الاندماج والاستحواذ، وتمتلك حصص أغلبية وأقلية في شركات تداول عام، وتبحث دائما عن عروض قيّمة في مجال الاستثمار العالمي والإقليمي.



كما تعد شركة الأمانة لمواد البناء، التي تتخذ من عمان مقراً لها، من أحد اهتمامات سجواني العديدة في عالم التجارة، وتمثل الشركة عدة أسماء عالمية شهيرة مثل “فيلروي أند بوخ”، و”غروهي”، و”دورنبراخت”. كما تضم محفظته أيضاً شركة الأنوار لبلاط السيراميك، وهي الأولى من ضمن الشركتين الوحيدتين المصنعتين للبلاط في الإمارات.



ومن إحدى مبادرات سجواني الاستثمارية الرئيسية في المنطقة هي شركة الجزيرة للخدمات، وهي شركة مدرجة في سوق مسقط للأوراق المالية. شغل سجواني أيضا منصب عضو مجلس إدارة في عدد من مجالس الإدارة، بما فيها “كلية مجان الجامعية” في العاصمة العُمانية مسقط، وشركة “جونو أون لاين” في نيويورك، وشركة “تكافل الإمارات” في أبوظبي.
اذا كنت ترى شيءً غير صحيح او ترغب بالمساهمه في هذا الموضوع، قم بمراجعه قسم السياسة التحريرية.",https://waya.media/arabi/%d9%85%d9%86-%d9%87%d9%88-%d8%ad%d8%b3%d9%8a%d9%86-%d8%b3%d8%ac%d9%88%d8%a7%d9%86%d9%8a%d8%9f/,رواد
