Title,Content,Link,Category
تغطية خاصة| ما الخطط المستقبلية لـ Tabby بعد حصولها على الجولة الاستثمارية الجديدة؟,"حصدت شركة “تابي” Tabby على  ٢٣ مليون دولار من الاستثمار في واحدة من أكبر جولات التمويل الأولى في الشرق الأوسط.  تأسست الشركة في ٢٠١٩، وتعمل على تقديم خدمة “اشتر الآن وادفع لاحقا”و وقد عملت تابي على إقامة شراكات مع تجار التجزئة لتوفير خيارات الدفع الآجل لعملائها عبر الإنترنت أو في المحلات التجارية ومنحهم القدرة على تأجيل الدفع لمدة تصل إلى ٣٠ يومًا أو الدفع على ٤ أقساط شهرية بدون أى رسوم إضافية على العملاء، ويمكن اليوم لعملاء تابي الاستفادة من الخدمة عبر أكثر من ٦٠٠ متجر.



تحدثنا مع حسام عرب المؤسس والمدير التنفيذي في Tabby وتالة الجابري الشريكة في HOF Capital أحد المستثمرين في الشركة، حول الجولة التمويلية الجديدة وأهداف الشركة وخططها في المستقبل.



“سنستخدم التمويل في توسيع فريق عملنا، وتطوير منتجاتنا وتقنياتنا على وجه التحديد، إضافة إلى العمل مع كبار قطاع التجزئة. هدفنا جعل “تابي” الطريقة الأكثر شيوعا واستخداما في الدفع عند العملاء، وللوصول لذلك، نحتاج للتأكد من أننا نبني منتجات يثق بها المستهلكون، ويقدرونها، ويتفاعلون معها” الحديث لحسام عرب حول أهدافهم في استخدام التمويل.



ويرى عرب أن أكبر التحديات التي واجهتهم في العمل هو توعية المستهلكين وتثقيفهم بفكرة جديدة نسبيا في السوق، نحن بحاجة إلى حل ومعالجة مخاوف العملاء المرتبطة بالمنتجات المالية، وضمان الشفافية الكاملة، رغم عدم وجود علاقة مباشرة مع المستهلكين، بل من خلال علاقتنا الأساسية بتجار التجزئة.  



“تابي لديها فهم عميق لاحتياجات العملاء. بنى الفريق أول نموذج عمل في الشرق الأوسط، يعالج مشكلة مهمة في المنطقة ويمكن تطبيقه في الأسواق الناشئة. يدرك تجار التجزئة الرائدون ذلك، ولهذا أختاروا الشراكة مع تابي”.تالة الجابري، شريكة في HOF Capitalويقول عرب حول رأيه عن ما يقدمه المستثمرون للشركات بجانب رأس المال : “نحن نبحث في المستثمر عن ما هو أكثر من مجرد رأس المال. على المستثمرين أن يكونوا قادرين على إظهار قيمة بوضوح لشركاتهم، وهذه القيمة تأتي في أشكال متنوعة، منها المعرفة، والوصول إلى الأسواق، والوصول إلى رأس مال أكثر، وغيرها. كما أننا نبحث عن مستثمرين يسهل التعامل معهم ويمنحوننا مساحة للعمل والتنفيذ”.



ومن جانبها تضيف تالة الجابري: “البحث عن طرق ملموسة يمكننا من خلالها دعم الفريق المؤسس لتحقيق رؤيته، هو أساس عمل “هوف كابيتال”. تتميز هوف بقدرتها على توسيع رحلة شركاتها. نظرا لكونه صندوقا عالميا للتمويل، له مكاتب في نيويورك وسان فرانسيسكو وأبو ظبي، تستطيع هوف الاستفادة من من أعلى مستوى من المواهب والمواد والخبرات. في حالة نموذج “اشتر الآن وادفع لاحقا”، نعمل على تشكيل معرفتنا وبناء شبكتنا منذ وقت، حيث استثمرنا في شركة Klarna التي ستطرح قريبا للاكتتاب العام”.



ترى الجابري أن أهم أسباب استثمارهم في “تابي”، يرجع إلى فهم الشركة العميق لاحتياجات العملاء، حيث بنى الفريق أول نموذج عمل في الشرق الأوسط، يعالج مشكلة مهمة في المنطقة، ويمكن تطبيقه في الأسواق الناشئة، وهو ما يدركه تجار التجزئة الرائدون ذلك، ولهذا أختاروا الشراكة مع تابي.



وتضيف: “يمكننا الاعتماد على شبكة من المواهب التقنية والمنظمين والمستثمرين والمحامين وتجار التجزئة في الأسواق المختلفة، لإضافة قيمة إلى تابي، إضافة إلى أن “هوف كابيتال” مدعومة بشبكة من أكثر من ٧٠ شريكا من الشركات الرائدة في العالم، مما يمنح قيمة إضافية لمؤسسينا، ويحقق لهم مكاسب في جميع المجالات”.



وعن الخطط المستقبلية لتابي، يختتم عرب حديثه: “هدفنا جعل “تابي” الطريقة الأكثر شيوعا واستخداما في الدفع عند العملاء، وللوصول لذلك، نحتاج للتأكد من أننا نبني منتجات يثق بها المستهلكون، ويقدرونها، ويتفاعلون معها”.
اذا كنت ترى شيءً غير صحيح او ترغب بالمساهمه في هذا الموضوع، قم بمراجعه قسم السياسة التحريرية.",https://waya.media/arabi/%d8%aa%d8%ba%d8%b7%d9%8a%d8%a9-%d8%ae%d8%a7%d8%b5%d8%a9-%d9%85%d8%a7-%d8%a7%d9%84%d8%ae%d8%b7%d8%b7-%d8%a7%d9%84%d9%85%d8%b3%d8%aa%d9%82%d8%a8%d9%84%d9%8a%d8%a9-%d9%84%d9%80-tabby-%d8%a8%d8%b9%d8%af/,شركات ناشئة
"eMushrif يحصد ٢,٣ مليون دولار في جولة تمويل أولى","حصلت شركة إي.مشرف eMushrif، على ٢,٣ مليون دولار في جولة تمويل أولى، بقيادة أي دي أو إنفيستمنت IDO Investments. وشهدت جولة الاستثمار أيضا مشاركة من فازا فينشرز Phaze Ventures وجاسور فينشرز otf Jasoor Ventures ودي تيك فينشرز Dtec Ventures وميراد هولدينج Myrad Holding ومستثمرون ملاك آخرون.



تستخدم “إي.مشرف” العمانية إنترنت الأشياء لتحويل الحافلات المدرسية العادية إلى حافلات ذكية لضمان سلامةالأطفال، كما طورت الشركة حلول إدارة التنقل لبعض القطاعات الأخرى في سلطنة عمان والكويت. وفقا لماجنيت.



كما زودت إي.مشرف حكومة عمان، وقت انتشار كورونا، بأجهزة قابلة للارتداء يستخدمها الأشخاص المعزولون، لمراقبة مدى امتثالهم للحجر الصحي، وتتصل تلك الأجهزة بتطبيق للهاتف ولوحات معلومات متطورة.



قال عدنان الشعيلي، الشريك المؤسس والرئيس التنفيذي، إي.مشرف لماجنيت: “نحن متحمسون لتلقي هذا الدعم الهائل من مستثمرينا، والذين يتماشون مع رؤيتنا للتوسع. من خلال الاستثمار الذي حصلنا عليه يمكننا الاستمرار في خدمة الآلاف من الآباء وإنقاذ الأرواح في الحافلات المدرسية واستعادة ثقة أولياء الأمور في النقل المدرسي.  



وأضاف الشعيلي: “نحن أيضا نحدث ثورة في خدمات التنقل في مجالات أخرى مثل النفط والغاز من خلال توفير نظام ذكي لإدارة التنقل وضمان سلامة المجتمع من خلال تطبيق الامتثال للحجر الصحي لـ كوفيد-9”.



وقال جوليان بلوزو، مدير الاستثمار، دي تيك لماجنيت: “ترى الشركة إمكانات كبيرة لـإي.مشرف في الإمارات العربية المتحدة وهي مستعدة لدعم المؤسسين للحصول على شراكة مع المؤسسات المحلية”.



ستدعم الأموال التي تم جمعها حديثا توسعها في الأسواق والقطاعات الأخرى عبر المنطقة. تخطط الشركة للاستثمار في تعزيز تطوير المنتجات من خلال إدخال تقنيات متطورة جديدة وتوسيع نطاق الإنتاج.
اذا كنت ترى شيءً غير صحيح او ترغب بالمساهمه في هذا الموضوع، قم بمراجعه قسم السياسة التحريرية.",https://waya.media/arabi/emushrif-%d9%8a%d8%ad%d8%b5%d8%af-%d9%a2%d9%a3-%d9%85%d9%84%d9%8a%d9%88%d9%86-%d8%af%d9%88%d9%84%d8%a7%d8%b1-%d9%81%d9%8a-%d8%ac%d9%88%d9%84%d8%a9-%d8%aa%d9%85%d9%88%d9%8a%d9%84-%d8%a3%d9%88%d9%84/,شركات ناشئة
Teami لحلول التكنولوجيا الصحية تغلق جولتها الاستثمارية الأولى,"أغلقت شركة تيمي Teami العراقية، جولتها الاستثمارية الأولى من خلال شبكة المستثمرين الممولين العراقيين. الجولة الخماسية من مجموعة من المستثمرين العراقيين المتميزين من بينهم: محمد الحكيم مدير عام كريم في العراق والأردن، والعراق تك فينشرز Iraqi Tech Ventures، وأحمد باقر، وكابيتاKAPITA.



تقدم  تيمي الشركة الناشئة، حلول حلول إدارة علاقات العملاء للوكلاء الطبيين في العراق، وفقا لماجنيت.



بالإضافة إلى الجولة التمويلية، حصلت تيمي على منح بقيمة 20 ألف دولار من جي إي زيد الألمانية GIZ عبر مشروعها “تكنولوجيا المعلومات والاتصالات للشباب في العراق” كجزء من دعم المنظمة لشبكة الملاك.



وقال محمد الحكيم، مدير عام كريم في العراق الأردن وأحد المستثمرين في الجولة: “تلبي تيمي احتياجات السوق الحقيقة، ونحن نرى إمكانيات كبيرة للشركة للاستحواذ على حصة سوقية قوية على مدى السنوات القليلة المقبلة. يمكن للتكنولوجيا أن تتصدى للعديد من التحديات التي تواجه العراق، وأرى مستقبل عظيم للشركات الناشئة العراقية”.  



وعلق علي السهيل، مدير شبكة المستثمرين الممولين العراقيين قائلا: “لا تزال هناك فرصة تكنولوجية كبيرة لخلق أفكار مختلفة في السوق العراقية، لكن تيمي دليل رائع على أن هناك العديد من المشكلات التي يجب معالجتها أولا داخل المجتمع المحلي باستخدام التكنولوجيا”. 
اذا كنت ترى شيءً غير صحيح او ترغب بالمساهمه في هذا الموضوع، قم بمراجعه قسم السياسة التحريرية.",https://waya.media/arabi/teami-%d9%84%d8%ad%d9%84%d9%88%d9%84-%d8%a7%d9%84%d8%aa%d9%83%d9%86%d9%88%d9%84%d9%88%d8%ac%d9%8a%d8%a7-%d8%a7%d9%84%d8%b5%d8%ad%d9%8a%d8%a9-%d8%aa%d8%ba%d9%84%d9%82-%d8%ac%d9%88%d9%84%d8%aa%d9%87/,شركات ناشئة
Tabby تحصد ٢٣ مليون دولار في جولة التمويل أ,"حصدت شركة “تابي” Tabby على  ٢٣ مليون دولار من الاستثمار في جولتها التمويلية أ بقيادة Arbor Venturesو Mubadala Capitalوبالمشاركة من STV ،Raed Ventures ،Global Founders Capital,JIMCO, Global Ventures, VentureSouq, Outliers ، MSA Capital, HOF Capital والبنك العربي. تهدف الجولة التمويلية إلى تعزيز نمو الشركة في المرحلة المقبلة، ودعم توسيع دائرة منتجاتها وقدراتها التقنية بالإضافة إلى قدرتها الإقراضية مما سيعود بالنفع لقاعدة شركاء تابي وعملاؤها. وتتوج هذه الجولة التمويلية العام الاستثنائي الذي شهدته تابي متمثلاً في انضمام عدد من كبار تجار التجزئة في المنطقة، وتنامياً في وتيرة التوسع في القطاع مدفوعاً بتطور طلب المستهلك.



منذ تأسيسها في عام ٢٠١٩ عملت تابي على إقامة شراكات مع تجار التجزئة لتوفير خيارات الدفع الآجل لعملائها عبر الإنترنت أو في المحلات التجارية ومنحهم القدرة على تأجيل الدفع لمدة تصل إلى ٣٠ يومًا أو الدفع على ٤ أقساط شهرية بدون أى رسوم إضافية على العملاء، ويمكن اليوم لعملاء تابي الاستفادة من الخدمة عبر أكثر من ٦٠٠ متجر، من بينهم شركات عالمية مثل IKEAو Toys R Usو Ace Hardware وقائمة من أكبر المتاجر الإقليمية الرائدة مثل؛ مجموعة الفطيم ومجموعة لاندمارك ومجموعة Apparel.



وقالت ميليسا جوزي، الشريك الإداري فيArbor Ventures: “نحن متحمسون للغاية لدعم شركة تابي الرائدة في منطقة الشرق الأوسط وشمال إفريقيا في قيادتها لقطاع المدفوعات الرقمية. ونشهد بشكل مستمر النمو المتسارع في قائمة شركاء تابي، وقدرتها على ابتكار أفضل وأسهل حلول الدفع  للمتاجر”.



وقال إبراهيم عجمي، رئيس المشاريع والاستثمار في مبادلة: “حلول اشتر الآن، ادفع لاحقاً تزدهرعالمياً بفضل التسارع في رقمنة المدفوعات، ورواج التجارة الالكترونية ولا تستثنى من ذلك منطقة الشرق الأوسط. حلول تابي للدفع تتناسب مع اعتقادنا بأن حلول التقنية المالية ستنتج تجارب أفضل للشركاء والمستهلكين. نحن متحمسون للشراكة مع حسام وفريقه في سعيهم لوضع تابي في مصاف روّاد التقنية المالية إقليماً”.  



وتمكنت تابي من الاستفادة من ثلاثة توجهات رئيسية في أعقاب أزمة كورونا لتعزيز نموها: انكماش قنوات التمويل للمستهلك، وتزايد اعتماد المستهلكين على طرق الدفع الرقمية، والتحول السريع في قطاع التجزئة إلى منصات التجارة الالكترونية. ووفقًا لتقرير صادر عن Kearney الشرق الأوسط، فقد بلغ متوسط ​​حصة الأسر الخليجية التي قامت بعمليات شراء عبر الإنترنت إلى أكثر من ٨٪ في عام ٢٠٢٠. وبالنظر إلى أن المتوسط في الأسواق المتقدمة يتراوح بين ١٦ و ٢٥٪، فإنه توجد فرصة كبيرة للنمو في مجال المدفوعات الرقمية. ويمكن مراقبة موجة التحول الرقمي هذه حتى في المحلات التجارية، حيث نمت المدفوعات الرقمية عبر نقاط البيع في المملكة العربية السعودية بنسبة ٤٩٥٪ خلال العام الماضي حتى سبتمبر، وفقًا للمدفوعات السعودية. وفي ظل تشديد البنوك في جميع أنحاء المنطقة سياساتها الائتمانية، وسعي المستهلكين بشكل متزايد في البحث عن طرق موثوقة لإدارة شؤونهم المالية، شهدت تابي رواجاً كبيراً في السوق لتوفيرها لخدمات الدفع الآجل “اشتر الآن وادفع لاحقًا”.



وتعمل تابي عبر الربط المباشر على صفحات شراء مواقع شركائها أو أنظمة نقاط البيع، مما يسهل منح المستهلكين تمويلاً فورياً عن طريق دفع ٢٥٪ فقط من قيمة مشترياتهم وقت الشراء وتقسيط المتبقي على ٣ أشهر. ولا تفرض تابي على عملائها أي فوائد أو رسوم طالما أتموا الدفع على الوقت، ويتم تحقيق الدخل الأساسي لتابي عن طريق احتساب عمولة على مبيعات المتجر التي تحصل عن طريق تابي.



وعلّق حسام عرب، الشريك المؤسس والرئيس التنفيذي لشركة تابي: ”أصبح تحول قطاع التجزئة إلى الانترنت واقعاً حتمياً، ويتزايد طلب المستهلكين الآن أكثر من أي وقت مضى على خيارات مريحة وموثوقة يمكنهم الاعتماد عليها أثناء التسوق وعند عملية الدفع. نحن فخورون جدًا بالقيمة التي تمكنّا من تقديمها لشركائنا من خلال تزويد عملائهم بطريقة دفع مريحة ومرنة“.



تقول الشركة أن ربط خدمة دفع تابي مع المتجر من شأنها زيادة معدلات تحقيق الشراء بأكثر من ٢٠٪ والمساهمة في رفع حجم سلة الشراء  من ٣٠٪ وحتى ٨٥٪ عبر تزويد المستهلكين بإمكانية الوصول إلى رصيد ائتمان فوري بدون تكلفة. علاوة على ذلك، تقول شركة تابي أنها ساعدت المتاجر الالكترونية في استبدال عملائهم للدفع نقدًا بالدفع الرقمي نتيجةً للقيمة التي تقدمها لهم طريقة دفع تابي .



يذكر أن إغلاق هذه الجولة التمويلية يأتي عقب إعلان تابي عن شراكتها مع فيزا وانضمامها إلى البيئة التشريعية التجريبية للبنك المركزي السعودي (ساما).
اذا كنت ترى شيءً غير صحيح او ترغب بالمساهمه في هذا الموضوع، قم بمراجعه قسم السياسة التحريرية.",https://waya.media/arabi/tabby-%d8%aa%d8%ad%d8%b5%d8%af-%d9%a2%d9%a3-%d9%85%d9%84%d9%8a%d9%88%d9%86-%d8%af%d9%88%d9%84%d8%a7%d8%b1-%d9%81%d9%8a-%d8%ac%d9%88%d9%84%d8%a9-%d8%a7%d9%84%d8%aa%d9%85%d9%88%d9%8a%d9%84-%d8%a3/,شركات ناشئة
Source Beauty تحصد تمويلا جديدا لتسريع نموها في السوق المصرية,"حصدت سورس بيوتي Source Beauty تمويلا جديدا من مجموعة آيس أند كومباني ACE & Company، دون أن تفصح عن قيمة التمويل، وتسعى الشركة إلى استغلال التمويل في تعزيز مكانتها في السوق وتسريع نموها، وزيادة الوعي بعلامتها التجارية.



تركز منصة سورس بيوتي للتجارة إلكترونية، التي انطلقت عام 2018، على بيع منتجات التجميل المحلية بأسعار متميزة، بالتعاون مع أكثر من 80 علامة تجارية.



آيس أند كومباني هي شركة استثمارية خاصة، تأسست عام 2005، تضم مجموعة من الاستثمارات المتنوعة مثل بينتريست Pinterest وتيك ستارز Techstars وترانسفير وايز Transferwise.



وتعد هذه الجولة الاستثمارية الثانية للشركة، إذ حصلت في مايو الماضي على تمويل من شركة 500 Startups، وفقا لبيان الشركة.  



تعليقا على هذا التمويل قالت ليديا شوندربيك، المؤسس والرئيس التنفيذي لشركة سورس بيوتي في بيان: “نا فخورة أننا نجحنا في جذب تمويل مجموعة عالمية مثل آيس أند كومباني، التي تولي اهتمامها لدعم قطاعات محددة بعينها وتستهدف مقدمي الخدمات المبتكرة الذين لديهم القدرة على تحقيق التغيير، وهذا دليل على ما وصلت إليه الشركة في السوق”.



وأكدت شوندربيك أن سورس بيوتي ليست فقط منصة تسويقية، وإنما هي أيضاً شركة رائدة تسثمر في المرأة وفي تمكينها بدءا من فريق الإدارة إلى قاعدة عميلاتنا والعلامات التجارية التي نمثلها وأسستها رائدات أعمال.



قال شريف الحلوجي، الشريك المؤسس والعضو المنتدب لمجموعة آيس أند كومباني، في البيان نفسه: “من المهم دائما أن نتقابل مع رواد الأعمال والشركات الناشئة التي لديها رؤية وأثر حقيقي وفعلي في السوق”.



 مضيفا أن هذا الاستثمار يعكس مدى اهتمام آيس أند كومباني القوي بنموذج الأعمال المتميز الذي يلعب دورا حيويا في إلهام وتمكين المرأة من خلال العمل على رفع وعيها.
اذا كنت ترى شيءً غير صحيح او ترغب بالمساهمه في هذا الموضوع، قم بمراجعه قسم السياسة التحريرية.",https://waya.media/arabi/source-beauty-%d8%aa%d8%ad%d8%b5%d8%af-%d8%aa%d9%85%d9%88%d9%8a%d9%84%d8%a7-%d8%ac%d8%af%d9%8a%d8%af%d8%a7-%d9%84%d8%aa%d8%b3%d8%b1%d9%8a%d8%b9-%d9%86%d9%85%d9%88%d9%87%d8%a7-%d9%81%d9%8a-%d8%a7%d9%84/,شركات ناشئة
“بن سلمان الخيرية” تستثمر ٨١٣ مليون ريال في شركة الألعاب الإلكترونية اليابانية SNK,"أعلنت مؤسسة محمد بن سلمان الخيرية “مسك الخيرية” استثمار بقيمة ٨١٣ مليون ريال في شركة الألعاب اليابانية إس إن كي SNK، وبذلك تستحوذ على حصة أولية في الشركة  بنسبة ٣٣.٣%، وفقا لإندبندنت عربية.



وبحسب الاتفاقيات الموقعة مع المساهمين البائعين في بورصة كوريا للأوراق المالية والمدرجة فيها شركة إس إن كي اليابانية، إذ تنص الاتفاقية كذلك على أن تشتري المؤسسة نسبة ١٧.٧٪ أخرى من أسهم إس إن كي في المستقبل لترفع حصتها من الاستثمار في ملكية الشركة إلى ٥١٪.



يأتي استثمار مؤسسة “بن سلمان الخيرية”  في شركة إس إن كي امتدادا للشراكة مع الشركة اليابانية، حيث عملت في الماضي على مشاريع مشتركة بمجال الرسوم المتحركة والألعاب الإلكترونية، بالتعاون معها من خلال شركة مانجا للإنتاج التابعة لمسك الخيرية، وقد اشتمل ذلك على برامج تبادل المعرفة للشباب السعوديين لزيارة اليابان كجزء من برنامج تدريبي والعمل معًا على تطوير الألعاب الإلكترونية.



يذكر أن “بن سلمان الخيرية” تتمتع بموارد مالية قوية وشهدت دعما ماليا كبيرا منذ نشأتها وعلى مر العشر سنوات الماضية بلغ ٤.٤ مليار ريال سعودي من مؤسسها ورئيس مجلس إدارتها الأمير محمد بن سلمان بن عبدالعزيز، بهدف الارتقاء بحياة الشباب السعودي من خلال تمكينهم وتنمية مهاراتهم وصقل مواهبهم الإبداعية.  
اذا كنت ترى شيءً غير صحيح او ترغب بالمساهمه في هذا الموضوع، قم بمراجعه قسم السياسة التحريرية.",https://waya.media/arabi/%d8%a8%d9%86-%d8%b3%d9%84%d9%85%d8%a7%d9%86-%d8%a7%d9%84%d8%ae%d9%8a%d8%b1%d9%8a%d8%a9-%d8%aa%d8%b3%d8%aa%d8%ab%d9%85%d8%b1-%d9%a8%d9%a1%d9%a3-%d9%85%d9%84%d9%8a%d9%88%d9%86-%d8%b1%d9%8a%d8%a7/,قطاعات
