Title,Content,Link,Category
إطلاق “أقول” أول تطبيق محادثات سعودي على الهواتف الذكية,"أعلنت منصة “هلا یلا” السعودية، إطلاق تطبيق “أقول” للمحادثات،  والذي يمر بمرحلته التجريبية على نظامي تشغيل “أي أو إس” iOS و “أندرويد” Android.



وأوضحت “هلا يلا” في بيان صحفي، أنها تتطلع من إطلاق هذا التطبيق إلى إحداث ضجة في مجال تهيمن عليه شركات عملاقة مثل “واتساب” Whatsapp و”ويشات” Wechat.



من خلال خلق تجربة محلية تحمل طابع المجتمع السعودي، مع ممیزات متقدمة مثل المكالمات الصوتیة، والمحادثات الشخصیة، والإعدادات الممیزة القابلة للتخصيص.



و”هلا يلا” هي منصة سعودية، تعتمد على إخبار المستخدمين بالأحداث والفعالیات الرياضية والترفيهيه والسياحية التي على مقربة منهم، مع إمكانية حجز التذاكر إلكترونيا.  



 قال يوسف شنطي الشریك المؤسس لهلا یلا: “مع استمرار نمو سوق تطبیقات المحادثات في جمیع أنحاء العالم، كان هدفنا في أقول بناء تطبیق حصري ومخصص لمجتمعنا، لذلك بدأنا في تصمیم برنامج محادثات موجّه للمستخدم السعودي، نقدّم من خلاله أفضلتجربة تواصل اجتماعي على الإطلاق بممیزات بسیطة ومتقدمة، وواجهة مستخدم تناسب التجربة السعودیة”.وأضاف شنطي: “سیستمتع مستخدمي أقول بتجربة تواصل فریدة ومریحة تضیف الكثیر لحیاتهم الیومیة، من خلال تصمیم بسیط وإعدادات احترافیة.”
اذا كنت ترى شيءً غير صحيح او ترغب بالمساهمه في هذا الموضوع، قم بمراجعه قسم السياسة التحريرية.",https://waya.media/arabi/%d8%a5%d8%b7%d9%84%d8%a7%d9%82-%d8%a3%d9%82%d9%88%d9%84-%d8%a3%d9%88%d9%84-%d8%aa%d8%b7%d8%a8%d9%8a%d9%82-%d9%85%d8%ad%d8%a7%d8%af%d8%ab%d8%a7%d8%aa-%d8%b3%d8%b9%d9%88%d8%af%d9%8a-%d8%b9%d9%84/,شركات ناشئة
الرئيس التنفيذي السابق في Just Eat يستثمر في elmenus وينضم لمجلس إداراتها,"أعلنت المنيوز عن استثمار ديفيد باتريس الرئيس التنفيذي السابق لشركة Just Eat العالمية لطلب الطعام، في الشركة، بجاب انضمامه أيضا إلى مجلس إدارتها. 



يعد انضمام ديفيد الي شركة المنيوز إضافة بارزة لما يتمتع به من خبرات وتجارب ناجحة عالميا في مجال طلب الطعام أونلاين مما يفتح أفق صياغة استراتيجية نمو طموحة واستكشاف فرص جديدة للتوسع. تركز خطط المنيوز خلال الشهور الـ ١٨ المقبلة على توسيع نطاق عروضها وزيادة حصتها السوقية، مع تعيين ٤ آلاف سائق جديد، وإثراء التجربة الاجتماعية والمخصصة بصورة شخصية لاكتشاف وطلب الأطباق التي يرغبون بها، وأيضا تمكين المطاعم من تأسيس شراكة أكثر قوة مع المنيوز



يتمتع ديفيد بخلفية واسعة في مجال ريادة الأعمال والاستثمار حيث انضم إلى Just Eat في عام ٢٠٠٦ عند بدء إطلاق أعمالها في المملكة المتحدة. نجح ديفيد في قيادة Just Eat في عمليات الاستحواذ والاستثمارات العالمية بما في ذلك الاستحواذ على MenuLog في أستراليا مقابل ٨٥٥ مليون دولار والاستحواذ على حصة الأغلبية في iFood البرازيلية. 



تولي ديفيد قيادة شركة Just Eat UK منذ بدايتها كشركة ناشئة حتى نجحت في أقل من عقد من الزمان في التحول إلى واحدة من أكبر شركات طلب الطعام في العالم بنجاحها اللافت في الحصول على تمويل أوروبي ضخم في أول طرح لأسهمها. يشغل ديفيد حاليا منصب الشريك الاستثماري في شركة 83 North العالمية لرأس المال الاستثماري، كما تحفل حافظته الاستثمارية بالعديد من الشركات الناشئة الناجحة.  



نشأت المنيوز كدليل شامل يوفر لمستخدميه قوائم طعام ومعلومات عما يزيد علي ١٠ آلاف مطعم مما أدى إلى تنامي جمهور المتابعين الذين يشاركوا حبهم للطعام عبر الصور والتقييمات. نجحت المنيوز في خلق مجتمع نشيط للغاية يجمع بين المستخدمين والمطاعم مما مكنها من إطلاق خدمة الطلب عبر الإنترنت في أواخر عام ٢٠١٨. 



تحقق لمنيوز النجاح السريع منذ ذلك الحين حيث تمكنت من الوفاء بالحاجة إلى منصات الطلب عبر الإنترنت في مصر المفتقرة إلى تلك الخدمة، حيث زادت إيراداتها بنسبة ٣٠٠٪، وكسبت حصة سوقية بارزة، وكل ذلك بتمويل يقدر بأقل من ١٠ ملايين دولار. وشمل ذلك نجاح دورة التمويل الثانية في عام ٢٠٢٠ – في جمع ٨ ملايين دولار – بقيادة شركة رأس المال الاستثماري الإماراتية Global Ventures وAlgebra Ventures. 



أشاد أمير علام الرئيس التنفيذي لشركة المنيوز بتميز السوق المصري الذي يحتل الصدارة بين الأسواق الرائدة في مجال توصيل الطعام، موضحا:” تقدم معظم المطاعم في مصر خدمات التوصيل على عكس العديد من البلدان الأخرى التي مازال يجري تطوير الخدمة بها. أدركت المنيوز ذلك في وقت مبكر وحرصت على التركيز على المساعدة في تحسين تجربة الطلب الشاملة للمطاعم والمستخدمين بالاستفادة من إمكاناتها التقنية الفريدة وإحصاءات السوق المحلية. ستساعدنا رؤية ديفيد كخبير متمرس في الصناعة في تسريع توسعاتنا وتوجيه استراتيجيتنا بشكل أكبر لنلبي احتياجات المزيد من البلدان في الشرق الأوسط بما يعزز من نمو الشركة”.



عبر ديفيد باتريس عن إعجابه بالنمو المتسارع والمتواصل الذي أحرزته المنيوز طوال العام الماضي محققة نتائج متميزة. لقد نجحت في تطوير منهجية فريدة في اكتشاف الطعام، مما جعلها الشريك الأقوى للمطاعم حيث توفر لهم ما يزيد علي كونها مجرد مقدم خدمة الطلب عبر الإنترنت. 



وبينما شهدت المنيوز نموا بمقدار ٣ أضعاف في عام ٢٠٢٠، حيث زادت خدمة التوصيل بشكل كبير في ضوء التحديات التي نشأت عن كوفيد-١٩، وارتفع معدل استعانة المطاعم بمقدمي خدمة مستقلين يختصوا بإدارة عمليات التوصيل، فمن المتوقع أن تشهد الشركة نمو بمعدل ١٠ أضعاف في عام ٢٠٢١ نتاجا لتوسيعها نطاق عروض منتجاتها ومطاعمها. نشهد في الفترة الحالية تطورا مثيرا في مراحل نمو الشركة”.
اذا كنت ترى شيءً غير صحيح او ترغب بالمساهمه في هذا الموضوع، قم بمراجعه قسم السياسة التحريرية.",https://waya.media/arabi/%d8%a7%d9%84%d8%b1%d8%a6%d9%8a%d8%b3-%d8%a7%d9%84%d8%aa%d9%86%d9%81%d9%8a%d8%b0%d9%8a-%d8%a7%d9%84%d8%b3%d8%a7%d8%a8%d9%82-%d9%81%d9%8a-just-eat-%d9%8a%d8%b3%d8%aa%d8%ab%d9%85%d8%b1-%d9%81%d9%8a-elmen/,شركات ناشئة
Starzplay تحصد تمويلا بالدين بقيمة ٢٥ مليون دولار من رؤيا بارتنرز,"حصلت ستارزبلاي Starzplay منصة مشاهدة الفيديو حسب الطلب في منطقة الشرق الأوسط وشمال أفريقيا، على تمويل مستقل بالدين بقيمة ٢٥ مليون دولار من شركة “رؤيا بارتنرز” التي تتخذ من أبوظبي مقرا لها.



سيستخدم التمويل بهدف تعزيز توسعها الجغرافي ووصولها إلى العملاء، وإضافة المزيد من المحتوى وإنتاج المحتوى الأصلي، وتعزيز القيمة الطويلة الأمد للأطراف المعنية كافة.



قال معاذ شيخ الرئيس التنفيذي والشريك المؤسس في ستارزبلاي في بيان صحفي: “تؤكد الشراكة الجديدة قدرتنا على استقطاب المستثمرين، مع استمرارنا بدفع عجلة نمونا وتعزيز أرباحنا. منظومة ريادة الأعمال التكنولوجية في الإمارات، إلى جانب هذا الاستثمار الجديد، سيساهمان بتعزيز مكانة ستارزبلاي وقدرتها على إنتاج المحتوى الأصلي، وتوسعها الجغرافي وترسيخ ريادتها كمنصة رقمية متميزة في منطقة الشرق الأوسط وشمال أفريقيا”.



وأضاف: “بفضل استثمار رؤيا بارتنرز سنمتلك أسسا قوية تمكننا من صياغة خططنا الفعالة، وخلق المزيد من القيمة للمساهمين وإدراج منصتنا في سوق الأوراق المالية”.  



ومن جانبه قال راشد صديقي الشريك المؤسس والشريك الإداري لشركة رؤيا بارتنرز: “يعتبر هذا التمويل إحدى خطواتنا الاستثمارية الرئيسية في قطاع التكنولوجيا في الإمارات، ولاسيما أن المنصة، تمكنت من الانتشار سريعا في السوق وتلبية الطلب المتنامي في قطاع الترفيه المنزلي”، لافتاً النظر إلى أن التمويل يعكس استراتيجيتنا الرامية لدعم الشركات التي تتمتع بأسس متينة وتمتلك كوادر إدارية متميزة تعمل بكفاءة عالية في ضوء مسار واضح المعالم، مدعوم بعمليات التخطيط والتنفيذ الأمثل وتحرص على خلق القيمة الطويلة الأمد.



يشار إلى أن ستارزبلاي كانت أول جهة تحصل على الترخيص في قطاع مشاهدة الفيديو حسب الطلب في دولة الإمارات، وحققت معدلات نمو سنوية لافتة. وصنفت “ستارزبلاي” ضمن قائمة “فاينانشال تايمز” لأفضل ٢٥ شركة ناشئة، حيث تقدم المحتوى الذي يلبي تطلعات المشاهدين، بناء على الدراسات والأبحاث، وتمتلك اليوم قائمة متنوعة من البرامج والأفلام والمسلسلات، وعلاقات واسعة مع أبرز استوديوهات الإنتاج مثل ديزني وورنر برذرز وغيرها. 



وتتوفر خدمة ستارزبلاي في ٢٠ دولة في الشرق الأوسط وشمال أفريقيا وباكستان، وتقدم للمشتركين محتوى يضم أكثر من ١٠ آلاف ساعة من الأفلام والمحتوى المخصص للأطفال والمسلسلات العربية والأعمال الحصرية، ووصل عدد مشتركي ستارزبلاي حاليا إلى ١,٨ مليون، وتم تحميل تطبيقها على أكثر من ٦ ملايين جهاز.
اذا كنت ترى شيءً غير صحيح او ترغب بالمساهمه في هذا الموضوع، قم بمراجعه قسم السياسة التحريرية.",https://waya.media/arabi/starzplay-%d8%aa%d8%ad%d8%b5%d8%af-%d8%aa%d9%85%d9%88%d9%8a%d9%84%d8%a7-%d8%a8%d8%a7%d9%84%d8%af%d9%8a%d9%86-%d8%a8%d9%82%d9%8a%d9%85%d8%a9-%d9%a2%d9%a5-%d9%85%d9%84%d9%8a%d9%88%d9%86-%d8%af%d9%88/,شركات ناشئة
“ماي سيارة” تجمع ٦٥٠ ألف دولار في جولة تمويل ما قبل الأولى,"أعلنت شركة “ماي سيارة” MySyara، ومقرها الإمارات العربية المتحدة، أنها جمعت ٦٥٠ ألف دولار في جولة تمويل ما قبل الأولى.



 كانت الجولة بقيادة شركة”جي أر سي” JRC Corporate Consulting (JRC)، التي عملت بصفة استشارية وجلبت عشرة مستثمرين للجولة.



تقدم “ماي سيارة” خدمات العناية الكاملة بالسيارة، بدءًا من غسيل السيارات بدون ماء عند عتبة الباب، إلى الإصلاحات الرئيسية والمساعدة على الطريق. 



سيتم طرح مجموعة “ماي سيارة” الكاملة من الخدمات عند الطلب في الربع الأول من عام ٢٠٢١ للعملاء في أبو ظبي والشارقة، مما يوسع قاعدة عملائه المحتملين.  



قال شيرينج شاندران، الشريك المؤسس والرئيس التنفيذي لشركة “ماي سيارة”: “منذ بداية جائحة كورونا مع ما نتج عنه من الإغلاق والتباعد الاجتماعي، سعى مالكو السيارات إلى إيجاد طرق أكثر أمانًا للحفاظ على سياراتهم دون مغادرة منازلهم”.



أضاف شاندران: “لقد ساعدتنا ظروف السوق المتغيرة هذه على تسجيل نمو في الإيرادات على أساس سنوي بنسبة ٦٠٠%، وقد تم تصميم حزم الخدمة الجديدة للتعامل مع اتجاهات السوق الجديدة هذه”.وتعليقً



 قال أنسر لطيف، الشريك المؤسس والمدير التنفيذي لشركة “ماي سيارة”: “إن سوق خدمات ما بعد البيع في الإمارات العربية المتحدة مهيأ للنمو ونحن عازمون على لعب دور رئيسي في هذا الأمر حيث نخطط للتوسع خارج دبي وفي بقية الإمارات العربية المتحدة، ثم المملكة العربية السعودية.



وأضاف لطيف: “نريد أن نمنح مالكي السيارات في جميع أنحاء المنطقة تجربة ما بعد البيع سلسة تمامًا مثل تحديث هاتفك الذكي. يبحث العملاء عن أقصى قدر من الراحة والنماذج التقليدية للخدمة والصيانة تكافح لتلبية هذه الحاجة – نحن هنا لتعطيل السوق وتحويل تجربة ملكية السيارة. “
اذا كنت ترى شيءً غير صحيح او ترغب بالمساهمه في هذا الموضوع، قم بمراجعه قسم السياسة التحريرية.",https://waya.media/arabi/%d9%85%d8%a7%d9%8a-%d8%b3%d9%8a%d8%a7%d8%b1%d8%a9-%d8%aa%d8%ac%d9%85%d8%b9-%d9%a6%d9%a5%d9%a0-%d8%a3%d9%84%d9%81-%d8%af%d9%88%d9%84%d8%a7%d8%b1-%d9%81%d9%8a-%d8%ac%d9%88%d9%84%d8%a9-%d8%aa%d9%85/,شركات ناشئة
“هلا یلا”.. أول منصة شاملة للترفيه والرياضة والسياحة في السعودية,"أراد مؤسسو المنصة  أن يسهلوا تجربة الترفیه في السعودیة، فقد كان من الصعب عليهم العثور على أمور مسلیة وتجارب ترفیهیة أو رياضية في السعودية، فلم تتواجد أي أنشطة سوى الجلوس في المنزل أو لعب ألعاب الفیدیو أو تناول الطعام في الخارج. 



وحتى إذا توفرت أحداث أو أنشطة ففي الغالب كان من الصعب السماع بها إلا بعد انتهائها، بالرغم من أن السعودية  في ذلك الوقت (أي قبل 8  سنوات) كانت من أكثر دول المنطقة استخداما لمنصات الإعلام والتواصل الاجتماعي.



 إلا أنه لم يكن هناك أي تطبیقات أو مواقع في المملكة، قد تم تطویرها أو تصمیمها لتلبي تلك الاحتياجات المحلیة. 



“لذا كانت هذه الفجوة هي المحفز الحقیقي للمؤسسين نديم وفهيم بخش وفاروق باندي، لتأسيس هلا يلا أول منصة شاملة للترفيه والرياضة والسياحة في السعودية”، كما قالت هداء أشرف، مديرة الإتصال والتسويق، هلا يلا، ونتعرف على المزيد حول المنصة في الحوار التالي:  



هي أول منصة وتطبیق سعودي شامل للریاضة والترفیه والسیاحة، إذ ركزت النسخة الأولى من المنصة على جانب تنظیم المباریات الریاضیة مع الأصدقاء (كرة القدم بشكل أساسي)، واكتشاف المباریات التي تحدث في محیطك والتي تحتاج إلى لاعبین، إلى جانب حجز أماكن لتنظیم المباریات.



 إلا أنه مع بداية التواصل مع  أماكن حجز الملاعب، اكتشفنا فرصة أكبر بكثیر، حیث إن معظم الملاعب الریاضیة لم تكن مجهزة للحجوزات عبر الإنترنت. 



وعندما تعمقنا في البحث، تأكدنا أنها لم تكن تقتصر على الأماكن الریاضیة بل كافة المراكز الترفیهیة التي تعتمد على الحجوزات أو التذاكر، فمعظمها تقوم بعملیة الحجز بشكل شخصي دون الاعتماد على الوسائل الرقمیة.



وقمنا بعد هذا الاكتشاف بالتوسع بسرعة في تطبیقنا وبدأنا بالتحرك نحو فكرة إنشاء منصة متكاملة تضم منظومة رقمیة كاملة لدعم الشركات والمستخدمین على حد سواء.



توضح مديرة الإتصال والتسويق: “أن فكرة هلا یلا تتمحور حول توفیر جمیع ما یتعلق بالترفیه والمرح ونمط الحیاة السعید والنشیط والتفاعلي في المملكة، إضافة إلى تمكین قطاعات الثقافة والریاضة والألعاب الإلكترونية”.



 منذ إطلاقها وسعت “هلا یلا” خدماته إلى حد كبیر لیشمل استكشاف الأحداث والفعالیات، والحجوزات وتنظیم الأنشطة والترویج لها وبناء مجموعات لمشاركة الهوایات. 



فتوفر  المنصة “كفو قیمز” وهو منصة ألعاب إلكترونیة وتطبیق اجتماعي أیضا، بالإضافة إلى “كورة” التطبیق الخاص لمجتمع كرة القدم وتنظیم المباریات، وتطبیق “أقول” للمراسلات الفوریة مع میزات تواصل اجتماعي سیتم إطلاقها قریبا  مما سیجعله منصة تواصل اجتماعي محلیة خاصة بالمملكة العربیة السعودیة.



وفيما يخص الشركات یوفر تطبیق “هلا یلا” الشامل إدارة الأحداث مع تحلیلات وتقاریر حیة. كما توفر منصة التسویق “جزیل” التي تقدم مزایا التسویق عبر مؤثري وسائل التواصل الاجتماعي مع إمكانیة مراقبة أداء الحملات التسویقیة منذ اللحظات الأولى لانطلاقها وتزوید العلامات التجاریة والمؤثرین بتقاریر مفصلة.



وصل عدد مستخدمي”هلا يلا” إلى ميلون شخص، كما تمكنت المنصة حتى الآن من بيع أكثر ملیون تذكرة لعدد كبير من الفاعليات والأحداث، بالإضافة إلى إدارة ٥٠٠ حدث وفاعلية، وتنظیم ١٠٠ بطولة، كما وصل عدد مشاهدي البث المباشر إلى ١٠ ملايين. 



نتیجة للإغلاق والقیود المفروضة على التجمعات، واجهنا كغیرنا في مجال الترفیه والریاضة، تأثیرات واضحة لجائحة كورونا على أعمالنا.



قبل وباء كورونا، كان التركیز الأساسي للمنصة على الأحداث الضخمة والأنشطة الریاضیة وغیرها من الفعالیات الترفیهیة والتي تم تعلیقها بین عشیة وضحاها.



إلا أننا نجحنا في التحول بسرعة كبیرة إلى الألعاب والریاضات الإلكترونیة، وقد ساعدتنا هذه الاستراتیجیة بشكل كبیر على تجاوز تحدیات الإغلاق.



وبدأنا بإدارة سلسلة بطولات “خلك فالبیت” Home At Stay عبر ذراع الألعاب الإلكترونیة لمنصة “هلا یلا” وهو منصة “كفو قیمز”.وتنافس اللاعبون من جمیع مستویات المهارة في العدید من البطولات بما فیها “فیفا” و”فورت نایت” و”ببجي” و”أوفر واتش” وغیرها على مجموعة واسعة من الجوائز.وبعد فترة وجیزة، استضفنا موسم هذا العام لبطولة “لاعبون بلا حدود” بالشراكة مع الاتحاد السعودي للریاضات الإلكترونیة والذهنیة وهي إحدى أضخم مسابقات الألعاب الإلكترونیة العالمیة حیث جمعت ١٠ ملایین دولار للجمعیات الخیریة التي تعمل على مكافحة تداعیات وتأثیرات الجائحة.



في المرحلة الراهنة، المملكة هي محور تركیزنا الأساسي، إلا أننا نضع على خارطة طریقنا المستقبلیة التوسع الإقلیمي ثم الدولي بالتأكید. وقد بدأنا بالفعل بتقدیم تجارب الریاضات والألعاب الإلكترونیة في الأسواق الدولیة مع بطولات مخصصة للاعبین في عدد من البلدان حول العالم.
اذا كنت ترى شيءً غير صحيح او ترغب بالمساهمه في هذا الموضوع، قم بمراجعه قسم السياسة التحريرية.",https://waya.media/arabi/%d9%87%d9%84%d8%a7-%db%8c%d9%84%d8%a7-%d8%a3%d9%88%d9%84-%d9%85%d9%86%d8%b5%d8%a9-%d8%b4%d8%a7%d9%85%d9%84%d8%a9-%d9%84%d9%84%d8%aa%d8%b1%d9%81%d9%8a%d9%87-%d9%88%d8%a7%d9%84%d8%b1%d9%8a%d8%a7/,شركات ناشئة
